image_path,caption,style
dataset/_imgs_cache/Leonardo6_memecap/img_00002871.jpg,When you trying to convey they love to watch a documentary of the history of parmesan Cheese,sarcastic-meme
dataset/_imgs_cache/Leonardo6_memecap/img_00002872.jpg,When you trying to convey that a burglar should stay away from their house at 3am because they're...,sarcastic-meme
dataset/_imgs_cache/Leonardo6_memecap/img_00002873.jpg,When you surprised that WinRar's company is still surviving,sarcastic-meme
dataset/_imgs_cache/Leonardo6_memecap/img_00002874.jpg,"When you trying to convey that they dislike modern Pokemon designs, despite popular opinion",sarcastic-meme
dataset/_imgs_cache/Leonardo6_memecap/img_00002875.jpg,When you trying to convey that they're not going to stop downloading restricted content from Nintendo,sarcastic-meme
dataset/_imgs_cache/Leonardo6_memecap/img_00002876.jpg,When you wonders if they are too old to watch fantasy shows because real life is horrible,sarcastic-meme
dataset/_imgs_cache/Leonardo6_memecap/img_00002877.jpg,"When you trying to convey that they think Reddit is like Facebook, but for Generation Z",sarcastic-meme
dataset/_imgs_cache/Leonardo6_memecap/img_00002878.jpg,When you trying to convey that man is scared of the bear they see,sarcastic-meme
dataset/_imgs_cache/Leonardo6_memecap/img_00002879.jpg,When you trying to convey that men photoshop themselves into outrageous fishing photos while women dream of having...,sarcastic-meme
dataset/_imgs_cache/Leonardo6_memecap/img_00002880.jpg,When you making the people of social media to understand the real tough,sarcastic-meme
dataset/_imgs_cache/Leonardo6_memecap/img_00002881.jpg,When you trying to convey that Twitter blue checkmarks are willing to blow up the site and destroy...,sarcastic-meme
dataset/_imgs_cache/Leonardo6_memecap/img_00002882.jpg,When you wants parents of twenty somethings to wait on grandkids since people the poster's age aren't ready...,sarcastic-meme
dataset/_imgs_cache/Leonardo6_memecap/img_00002883.jpg,When you trying to convey that how smaller countries feel intimidated before a bigger country,sarcastic-meme
dataset/_imgs_cache/Leonardo6_memecap/img_00002884.jpg,"When you trying to convey that men give more importance to cars, unlike women",sarcastic-meme
dataset/_imgs_cache/Leonardo6_memecap/img_00002885.jpg,"The poster is impressed with the video game ""stray"" and thinks it should be the game of the...",sarcastic-meme
dataset/_imgs_cache/Leonardo6_memecap/img_00002886.jpg,The meme poster feels bad about the people for not recognizing his emotions towards the Christmas movie,sarcastic-meme
dataset/_imgs_cache/Leonardo6_memecap/img_00002887.jpg,When you trying to convey how excel spreadsheet can accomodate alot of tasks and has a lot of...,sarcastic-meme
dataset/_imgs_cache/Leonardo6_memecap/img_00002888.jpg,When you trying to convey men and women think differently,sarcastic-meme
dataset/_imgs_cache/Leonardo6_memecap/img_00002889.jpg,"The meme poster describes his situation a his friends home, where his poop doesn't get flushed away",sarcastic-meme
dataset/_imgs_cache/Leonardo6_memecap/img_00002890.jpg,The meme poster mocks Jeff Bezos for his poor decision and unkind behavior,sarcastic-meme
dataset/_imgs_cache/Leonardo6_memecap/img_00002891.jpg,"When you expressing the situation of Vietnam war where, the soldiers hiding behind the plants",sarcastic-meme
dataset/_imgs_cache/Leonardo6_memecap/img_00002892.jpg,"When you trying to convey that though the meme poster got the connection with some adjustments from them,...",sarcastic-meme
dataset/_imgs_cache/Leonardo6_memecap/img_00002893.jpg,The meme poster hesitates to say that they were married as they are afraid of losing their fan...,sarcastic-meme
dataset/_imgs_cache/Leonardo6_memecap/img_00002894.jpg,The meme poster mocks Arabic by comparing it with French for giving gender pronouns to objects,sarcastic-meme
dataset/_imgs_cache/Leonardo6_memecap/img_00002895.jpg,When you trying to convey that Putin's generals can't hear what he says because the table is so...,sarcastic-meme
dataset/_imgs_cache/Leonardo6_memecap/img_00002896.jpg,The meme poster mocks the gamers who spent $200 for that game,sarcastic-meme
dataset/_imgs_cache/Leonardo6_memecap/img_00002897.jpg,When you wants to make a bad joke and don't care who will resist them,sarcastic-meme
dataset/_imgs_cache/Leonardo6_memecap/img_00002898.jpg,When you trying to convey that Shrek drank a potion to become unnaturally stronger to impress his girlfriend,sarcastic-meme
dataset/_imgs_cache/Leonardo6_memecap/img_00002899.jpg,When you sits wondering what when wrong in their life when they are waiting for a game to...,sarcastic-meme
dataset/_imgs_cache/Leonardo6_memecap/img_00002900.jpg,When you wants everyone to know both men and women have it hard,sarcastic-meme
dataset/_imgs_cache/Leonardo6_memecap/img_00002901.jpg,When you trying to convey that the politician clowns don't even know anything about the global warming they...,sarcastic-meme
dataset/_imgs_cache/Leonardo6_memecap/img_00002902.jpg,When you trying to convey that their boss wouldn't even think about giving them off for Christmas and...,sarcastic-meme
dataset/_imgs_cache/Leonardo6_memecap/img_00002903.jpg,When you trying to convey that there are people that are anal about population estimates like so,sarcastic-meme
dataset/_imgs_cache/Leonardo6_memecap/img_00002904.jpg,When you trying to convey that it's difficult for them not to laugh at inappropriate jokes in front...,sarcastic-meme
dataset/_imgs_cache/Leonardo6_memecap/img_00002905.jpg,The meme poster illustrates the idea of laziness,sarcastic-meme
dataset/_imgs_cache/Leonardo6_memecap/img_00002906.jpg,When you trying to convey that it annoys them when their sleeping bag is too big for the...,sarcastic-meme
dataset/_imgs_cache/Leonardo6_memecap/img_00002907.jpg,When you trying to convey that the water jugs at home look very much like the heads on...,sarcastic-meme
dataset/_imgs_cache/Leonardo6_memecap/img_00002908.jpg,Poster believes that clothes can make one appear intelligent,sarcastic-meme
dataset/_imgs_cache/Leonardo6_memecap/img_00002909.jpg,When you trying to convey that they need their dab pen at work to make it through the...,sarcastic-meme
dataset/_imgs_cache/Leonardo6_memecap/img_00002910.jpg,When you trying to convey that how someone feels after great expectations are failed to be met,sarcastic-meme
dataset/_imgs_cache/Leonardo6_memecap/img_00002911.jpg,When you trying to convey that the camera in Discord is close on the face before logging out,sarcastic-meme
dataset/_imgs_cache/Leonardo6_memecap/img_00002912.jpg,When you trying to convey that woman relatives can all look at you disapproving no matter how removed...,sarcastic-meme
dataset/_imgs_cache/Leonardo6_memecap/img_00002913.jpg,Poster thinks some clothes can express confidence,sarcastic-meme
dataset/_imgs_cache/Leonardo6_memecap/img_00002914.jpg,The meme poster seems to be making fun of his malfunctioning old phone which does not have all...,sarcastic-meme
dataset/_imgs_cache/Leonardo6_memecap/img_00002915.jpg,When you unreasonably happy for jerking off but then sees blood,sarcastic-meme
dataset/_imgs_cache/Leonardo6_memecap/img_00002916.jpg,When you trying to convey that they regret starting a debate about the Falklands,sarcastic-meme
dataset/_imgs_cache/Leonardo6_memecap/img_00002917.jpg,When you feels pity towards the world citizens for making the world population to reach 8 billion,sarcastic-meme
dataset/_imgs_cache/Leonardo6_memecap/img_00002918.jpg,When you making fun of how they used to believe that chocolate milk came from brown cows,sarcastic-meme
dataset/_imgs_cache/Leonardo6_memecap/img_00002919.jpg,When you trying to convey that retail workers are trying to market both Halloween and Christmas at the...,sarcastic-meme
dataset/_imgs_cache/Leonardo6_memecap/img_00002920.jpg,When you trying to convey that the person who discovered the wheel is unimpressed with others who haven't...,sarcastic-meme
dataset/_imgs_cache/Leonardo6_memecap/img_00002921.jpg,When you troubled that people in society get more pissed with people hitting their pets than when people...,sarcastic-meme
dataset/_imgs_cache/Leonardo6_memecap/img_00002922.jpg,When you trying to convey that the band The Beegees do not look like their usual selves,sarcastic-meme
dataset/_imgs_cache/Leonardo6_memecap/img_00002923.jpg,When you tired of getting calls from telemarketers about their car's extended warranty,sarcastic-meme
dataset/_imgs_cache/Leonardo6_memecap/img_00002924.jpg,When you trying to convey that the international community is begging Russia to lie then rejoices when they...,sarcastic-meme
dataset/_imgs_cache/Leonardo6_memecap/img_00002925.jpg,When you trying to convey that 5-year-olds have big dreams,sarcastic-meme
dataset/_imgs_cache/Leonardo6_memecap/img_00002926.jpg,"When you trying to convey that Anti-Vaxxers are just as dumb as the flat earth conpsiracy people, now...",sarcastic-meme
dataset/_imgs_cache/Leonardo6_memecap/img_00002927.jpg,When you trying to convey that the people who know the weird al meme have a different response...,sarcastic-meme
dataset/_imgs_cache/Leonardo6_memecap/img_00002928.jpg,When you realizes Twitter has always been bad,sarcastic-meme
dataset/_imgs_cache/Leonardo6_memecap/img_00002929.jpg,When you trying to convey that green cartoon characters are all around and judging you,sarcastic-meme
dataset/_imgs_cache/Leonardo6_memecap/img_00002930.jpg,When you proud of his friends for standing up for him when he was bullied by others,sarcastic-meme
dataset/_imgs_cache/Leonardo6_memecap/img_00002931.jpg,When you trying to convey that every political debates are people calling the other side terrorists,sarcastic-meme
dataset/_imgs_cache/Leonardo6_memecap/img_00002932.jpg,When you trying to convey that Namor accuses Aquaman of stealing everything but Aquaman doesn't know who he...,sarcastic-meme
dataset/_imgs_cache/Leonardo6_memecap/img_00002933.jpg,When you trying to convey that even though before the take over of the meme poster by Elon...,sarcastic-meme
dataset/_imgs_cache/Leonardo6_memecap/img_00002934.jpg,When you saying that the comic version of a character is so different from the movie version of...,sarcastic-meme
dataset/_imgs_cache/Leonardo6_memecap/img_00002935.jpg,When you tries to make passing their drivers test exciting,sarcastic-meme
dataset/_imgs_cache/Leonardo6_memecap/img_00002936.jpg,When you is lowkey into Sherlock holmes so they think Enola Holmes 2 is trash,sarcastic-meme
dataset/_imgs_cache/Leonardo6_memecap/img_00002937.jpg,When you trying to convey that Twitter users are trying to figure out which blue checkmark users are...,sarcastic-meme
dataset/_imgs_cache/Leonardo6_memecap/img_00002938.jpg,When you trying to convey that the lockers stink due to the rotting fruit the meme poster keeps...,sarcastic-meme
dataset/_imgs_cache/Leonardo6_memecap/img_00002939.jpg,The meme poster compared with other social media followers and got scared about his strategy,sarcastic-meme
dataset/_imgs_cache/Leonardo6_memecap/img_00002940.jpg,When you can barely lift weights in real life but is swole in all the video games,sarcastic-meme
dataset/_imgs_cache/Leonardo6_memecap/img_00002941.jpg,The meme poster mocks the hot climate of Ohio,sarcastic-meme
dataset/_imgs_cache/Leonardo6_memecap/img_00002942.jpg,"When you gets pissed when they're neck starts itching, but their hands are wet and soapy from washing...",sarcastic-meme
dataset/_imgs_cache/Leonardo6_memecap/img_00002943.jpg,When you trying to convey that Bumblebee anatomy is bum heavy,sarcastic-meme
dataset/_imgs_cache/Leonardo6_memecap/img_00002944.jpg,The meme poster smartly escapes from the consequences that happened by his advises to people,sarcastic-meme
dataset/_imgs_cache/Leonardo6_memecap/img_00002945.jpg,"When you planning on skimming through the book, despite their teacher telling them to read every chapter",sarcastic-meme
dataset/_imgs_cache/Leonardo6_memecap/img_00002946.jpg,When you trying to convey they dislike the character anakin,sarcastic-meme
dataset/_imgs_cache/Leonardo6_memecap/img_00002947.jpg,When you trying to convey that sweet tea drinkers are scared of anyone who doesn't drink tea with...,sarcastic-meme
dataset/_imgs_cache/Leonardo6_memecap/img_00002948.jpg,The meme poster's grandpa is storing lots and lot of complex and collaged data rather than simply using...,sarcastic-meme
dataset/_imgs_cache/Leonardo6_memecap/img_00002949.jpg,When you trying to convey that Elon is confused why people are not having fun on Twitter after...,sarcastic-meme
dataset/_imgs_cache/Leonardo6_memecap/img_00002950.jpg,When you trying to convey that a two year old can cause a lot of pain to them...,sarcastic-meme
dataset/_imgs_cache/Leonardo6_memecap/img_00002951.jpg,When you trying to convey that women kick him out of the obgyn rooms because he is too...,sarcastic-meme
dataset/_imgs_cache/Leonardo6_memecap/img_00002952.jpg,When you trying to convey that they're tired of intrusive thoughts that they can't shut off,sarcastic-meme
dataset/_imgs_cache/Leonardo6_memecap/img_00002953.jpg,When you trying to convey that art teachers are very emotional about a quote about how important art...,sarcastic-meme
dataset/_imgs_cache/Leonardo6_memecap/img_00002954.jpg,When you trying to convey that spiderman sees Daffy Duck every where they go,sarcastic-meme
dataset/_imgs_cache/Leonardo6_memecap/img_00002955.jpg,When your brain is torturing them with their past good conversations with women,sarcastic-meme
dataset/_imgs_cache/Leonardo6_memecap/img_00002956.jpg,When you trying to convey that they lied to their middle-aged coworker about looking young,sarcastic-meme
dataset/_imgs_cache/Leonardo6_memecap/img_00002957.jpg,When you trying to convey they enjoying watching their football team not loose,sarcastic-meme
dataset/_imgs_cache/Leonardo6_memecap/img_00002958.jpg,The poster feels that no one can be perfect and he is making a self assessment by giving...,sarcastic-meme
dataset/_imgs_cache/Leonardo6_memecap/img_00002959.jpg,When you watches a tv show and sees a meme in progress making them unreasonably happy,sarcastic-meme
dataset/_imgs_cache/Leonardo6_memecap/img_00002960.jpg,When you trying to convey that the four tv shows pictured had the greatest endings,sarcastic-meme
dataset/_imgs_cache/Leonardo6_memecap/img_00002961.jpg,When you trying to convey that sister mocks you for finding out you were adopted,sarcastic-meme
dataset/_imgs_cache/Leonardo6_memecap/img_00002962.jpg,"The meme poster realizes that 2017 was five years ago, and the time flies by",sarcastic-meme
dataset/_imgs_cache/Leonardo6_memecap/img_00002963.jpg,When you asking for the perfect Nintendo 64 by having McDonald's collaboration in his mind,sarcastic-meme
dataset/_imgs_cache/Leonardo6_memecap/img_00002964.jpg,Poster want his friend to know he cares about him by not locking door and making it sound...,sarcastic-meme
dataset/_imgs_cache/Leonardo6_memecap/img_00002965.jpg,"When you trying to convey that though it was the last alarm, the meme poster doesn't like to...",sarcastic-meme
dataset/_imgs_cache/Leonardo6_memecap/img_00002966.jpg,"The meme poster states that, he dislike the AI generated art because it isn't look good",sarcastic-meme
dataset/_imgs_cache/Leonardo6_memecap/img_00002967.jpg,When you trying to convey that Mariah makes a lot of money from All I Want for Christmas...,sarcastic-meme
dataset/_imgs_cache/Leonardo6_memecap/img_00002968.jpg,When you trying to convey that they're desperate enough to visit a sketchy website for Robux,sarcastic-meme
dataset/_imgs_cache/Leonardo6_memecap/img_00002969.jpg,Poster does not want to study for exams because he or she would rsther watch anime,sarcastic-meme
dataset/_imgs_cache/Leonardo6_memecap/img_00002970.jpg,"When you decides they are tired of the Drake version, so they decide to do a different one...",sarcastic-meme
dataset/_imgs_cache/Leonardo6_memecap/img_00002971.jpg,When you trying to copy work of friend who also didn't study for the test,sarcastic-meme
dataset/_imgs_cache/Leonardo6_memecap/img_00002972.jpg,The meme poster has lost interest in the Twitter verification tick after it became for sale,sarcastic-meme
dataset/_imgs_cache/Leonardo6_memecap/img_00002973.jpg,When you trying to convey that Twitter users are bored with Elon trying to get attention on Twitter,sarcastic-meme
dataset/_imgs_cache/Leonardo6_memecap/img_00002974.jpg,"When you trying to convey that though the meme poster doesn't like the offering from society, she accepts...",sarcastic-meme
dataset/_imgs_cache/Leonardo6_memecap/img_00002975.jpg,When you has the right answer on a test but switched it at the last minute and got...,sarcastic-meme
dataset/_imgs_cache/Leonardo6_memecap/img_00002976.jpg,When you trying to convey that fullmetal alchemist is the bet show on netflix with a big smile,sarcastic-meme
dataset/_imgs_cache/Leonardo6_memecap/img_00002977.jpg,When you facing a lot of struggles due to natural calamities,sarcastic-meme
dataset/_imgs_cache/Leonardo6_memecap/img_00002978.jpg,The meme poster was mocked for the increased population in the world as the meme poster was the...,sarcastic-meme
dataset/_imgs_cache/Leonardo6_memecap/img_00002979.jpg,"When you trying to express the feelings of a frog that, a frog is accepting the rejection of...",sarcastic-meme
dataset/_imgs_cache/Leonardo6_memecap/img_00002980.jpg,When you makes masturbation joke about being stuck on a roller coaster for a long time but can't...,sarcastic-meme
dataset/_imgs_cache/Leonardo6_memecap/img_00002981.jpg,When you trying to convey that the cat outside at 2 am is stopping the meme poster from...,sarcastic-meme
dataset/_imgs_cache/Leonardo6_memecap/img_00002982.jpg,"When you shocked that, the meme poster's Dad was the killer",sarcastic-meme
dataset/_imgs_cache/Leonardo6_memecap/img_00002983.jpg,When you trying to convey that how distractive one can easily be being interrupted,sarcastic-meme
dataset/_imgs_cache/Leonardo6_memecap/img_00002984.jpg,When you conveying the elon musk is going to crash and burn when running twitter,sarcastic-meme
dataset/_imgs_cache/Leonardo6_memecap/img_00002985.jpg,When you trying to convey that the world is ignoring the population is going to be too much...,sarcastic-meme
dataset/_imgs_cache/Leonardo6_memecap/img_00002986.jpg,"The meme poster thinks getting the paid twitter service, twitter blue, isn't a big deal anymore and doesn't...",sarcastic-meme
dataset/_imgs_cache/Leonardo6_memecap/img_00002987.jpg,When you conveying that the monkeys had it easier than us,sarcastic-meme
dataset/_imgs_cache/Leonardo6_memecap/img_00002988.jpg,When you mocking IKEA's ideology and advises,sarcastic-meme
dataset/_imgs_cache/Leonardo6_memecap/img_00002989.jpg,The meme poster mocks the anime glasses for it's peak brightness at the scenes,sarcastic-meme
dataset/_imgs_cache/Leonardo6_memecap/img_00002990.jpg,When you trying to convey that they feel like the odd one out in their group of friends,sarcastic-meme
dataset/_imgs_cache/Leonardo6_memecap/img_00002991.jpg,When you trying to convey that the person the father's the 8th billion person on the planet will...,sarcastic-meme
dataset/_imgs_cache/Leonardo6_memecap/img_00002992.jpg,When you annoyed because their blanket always gets twisted up at night,sarcastic-meme
dataset/_imgs_cache/Leonardo6_memecap/img_00002993.jpg,The meme poster feels like being on a roller coaster made him feel like that pandemonium,sarcastic-meme
dataset/_imgs_cache/Leonardo6_memecap/img_00002994.jpg,When you doesn't like their job and is confused about what they are supposed to do,sarcastic-meme
dataset/_imgs_cache/Leonardo6_memecap/img_00002995.jpg,When you trying to convey that the songwriter is making songs about things that are happening in the...,sarcastic-meme
dataset/_imgs_cache/Leonardo6_memecap/img_00002996.jpg,When you trying to convey that they think Elon Musk knew they might make Twitter worse when they...,sarcastic-meme
dataset/_imgs_cache/Leonardo6_memecap/img_00002997.jpg,When you made a sitting pun about a dog that sits on every dog they find,sarcastic-meme
dataset/_imgs_cache/Leonardo6_memecap/img_00002998.jpg,"When you trying to convey that it surprises them when a cockroach they are about to step on,...",sarcastic-meme
dataset/_imgs_cache/Leonardo6_memecap/img_00002999.jpg,The meme poster feels he gets into PSTD even without any trauma happening unlike the soldiers who have...,sarcastic-meme
dataset/_imgs_cache/Leonardo6_memecap/img_00003000.jpg,When you just forgot what they remembered ten seconds ago,sarcastic-meme
dataset/_imgs_cache/Leonardo6_memecap/img_00003001.jpg,When you trying to convey that a date at a tree is supposedly the place where no evil...,sarcastic-meme
dataset/_imgs_cache/Leonardo6_memecap/img_00003002.jpg,When you trying to convey that Holyfield is willing to forgive and work with Mike Tyson who bit...,sarcastic-meme
dataset/_imgs_cache/Leonardo6_memecap/img_00003003.jpg,The meme poster mocks modern Greeks by comparing themselves with their ancients,sarcastic-meme
dataset/_imgs_cache/Leonardo6_memecap/img_00003004.jpg,"When you trying to convey that when a mechanic is near a car, it starts to work",sarcastic-meme
dataset/_imgs_cache/Leonardo6_memecap/img_00003005.jpg,When you prefers his things with a little flair rather than just practicalilty,sarcastic-meme
dataset/_imgs_cache/Leonardo6_memecap/img_00003006.jpg,When you trying to convey that how an image may look when viewed by different people,sarcastic-meme
dataset/_imgs_cache/Leonardo6_memecap/img_00003007.jpg,When you mad companies are now putting memes into their ads,sarcastic-meme
dataset/_imgs_cache/Leonardo6_memecap/img_00003008.jpg,When you doesn't understand a current meme and is too scared to find out about it,sarcastic-meme
dataset/_imgs_cache/Leonardo6_memecap/img_00003009.jpg,"When you thinks it's funny when they pretend to throw a ball, but their dog tries to fetch...",sarcastic-meme
dataset/_imgs_cache/Leonardo6_memecap/img_00003010.jpg,When you feels uncomfortable in a party because he hasn't taken his meds,sarcastic-meme
dataset/_imgs_cache/Leonardo6_memecap/img_00003011.jpg,When you praising Sonic as it was watched by legends and mocking Thor as kid's show,sarcastic-meme
dataset/_imgs_cache/Leonardo6_memecap/img_00003012.jpg,When you trying to convey that they feel very patriotic on national meme day,sarcastic-meme
dataset/_imgs_cache/Leonardo6_memecap/img_00003013.jpg,When you trying to convey that a tech billionaire is pitching another bad tech idea while Twitter and...,sarcastic-meme
dataset/_imgs_cache/Leonardo6_memecap/img_00003014.jpg,When you trying to convey that people are gonna hunt animals again,sarcastic-meme
dataset/_imgs_cache/Leonardo6_memecap/img_00003015.jpg,When you describing the feeling of when a teachers asks you to repeat a joke,sarcastic-meme
dataset/_imgs_cache/Leonardo6_memecap/img_00003016.jpg,When you trying to convey that major corporations enjoy price gouging consumers for 20 bucks of materials,sarcastic-meme
dataset/_imgs_cache/Leonardo6_memecap/img_00003017.jpg,The meme poster mocks the world for reaching 8 billion population,sarcastic-meme
dataset/_imgs_cache/Leonardo6_memecap/img_00003018.jpg,When you trying to take care of their back to game for 8 hours this weekend,sarcastic-meme
dataset/_imgs_cache/Leonardo6_memecap/img_00003019.jpg,When you trying to convey that the dog will hunt even the baby,sarcastic-meme
dataset/_imgs_cache/Leonardo6_memecap/img_00003020.jpg,When you trying to convey that people who know about blue waffle condition are traumatized whenever they are...,sarcastic-meme
dataset/_imgs_cache/Leonardo6_memecap/img_00003021.jpg,When you trying to convey that car manufacturers receive a common sense complaint from consumers and completely ignore...,sarcastic-meme
dataset/_imgs_cache/Leonardo6_memecap/img_00003022.jpg,When you trying to convey that Mess poster made a mess of the bathroom and knows someone will...,sarcastic-meme
dataset/_imgs_cache/Leonardo6_memecap/img_00003023.jpg,When you showing his wealth against his haters,sarcastic-meme
dataset/_imgs_cache/Leonardo6_memecap/img_00003024.jpg,When you trying to convey that girls are down bad they'll never achieve unrealistic standards of beauty while...,sarcastic-meme
dataset/_imgs_cache/Leonardo6_memecap/img_00003025.jpg,When you trying to convey what their friends think they do working as vet and showing what they...,sarcastic-meme
dataset/_imgs_cache/Leonardo6_memecap/img_00003026.jpg,When you teases Destiny for being hacked,sarcastic-meme
dataset/_imgs_cache/Leonardo6_memecap/img_00003027.jpg,"When you trying to convey that the missing ""dawg"" in question isn't actually a dog, but a good...",sarcastic-meme
dataset/_imgs_cache/Leonardo6_memecap/img_00003028.jpg,When you doesn't sweat the normal capcha stuff but now they are requiring complex math problems,sarcastic-meme
dataset/_imgs_cache/Leonardo6_memecap/img_00003029.jpg,"When you trying to convey that Hermione has every chance they can get to win against Willow, and...",sarcastic-meme
dataset/_imgs_cache/Leonardo6_memecap/img_00003030.jpg,When you feeling old because they have to explain how to use a clock to kids,sarcastic-meme
dataset/_imgs_cache/Leonardo6_memecap/img_00003031.jpg,When you challenges users to name everyone in the photo of the hip hop group,sarcastic-meme
dataset/_imgs_cache/Leonardo6_memecap/img_00003032.jpg,When you trying to convey that administrators would rather throw an employee out of the window rather than...,sarcastic-meme
dataset/_imgs_cache/Leonardo6_memecap/img_00003033.jpg,The poster feels like they are one with the animals when they pet a random dog,sarcastic-meme
dataset/_imgs_cache/Leonardo6_memecap/img_00003034.jpg,When you trying to convey that hardpoint gamers are truly scared of playing just the objectives in games,sarcastic-meme
