image_path,caption,style
dataset/_imgs_cache/Leonardo6_memecap/img_00000000.jpg,When you frustrated about the format of the website and is making a suggestion for improvement,sarcastic-meme
dataset/_imgs_cache/Leonardo6_memecap/img_00000001.jpg,When you saying that searching Google plus the term you want to search on reddit is better than...,sarcastic-meme
dataset/_imgs_cache/Leonardo6_memecap/img_00000002.jpg,When you feeling down bad,sarcastic-meme
dataset/_imgs_cache/Leonardo6_memecap/img_00000003.jpg,When you saying that Reddit is more fun than Instagram,sarcastic-meme
dataset/_imgs_cache/Leonardo6_memecap/img_00000004.jpg,When you making fun of the Area 51 raid,sarcastic-meme
dataset/_imgs_cache/Leonardo6_memecap/img_00000005.jpg,When you making fun of Europe's fascination with Area 51,sarcastic-meme
dataset/_imgs_cache/Leonardo6_memecap/img_00000006.jpg,When you shows what it looks like waiting for a long time,sarcastic-meme
dataset/_imgs_cache/Leonardo6_memecap/img_00000007.jpg,When you mad at how slow Reddit is when it comes to uploading content,sarcastic-meme
dataset/_imgs_cache/Leonardo6_memecap/img_00000008.jpg,When you making fun of parents when they make a fuss over turning the interior lights in the...,sarcastic-meme
dataset/_imgs_cache/Leonardo6_memecap/img_00000009.jpg,When you unreasonably happy because his parents are proud of his video game victory,sarcastic-meme
dataset/_imgs_cache/Leonardo6_memecap/img_00000010.jpg,The cat doesn't come unless you whisper random sounds to it,sarcastic-meme
dataset/_imgs_cache/Leonardo6_memecap/img_00000011.jpg,When you unreasonably happy about all of the memes they saw this year,sarcastic-meme
dataset/_imgs_cache/Leonardo6_memecap/img_00000012.jpg,When you proud of being the only person to support a bad meme,sarcastic-meme
dataset/_imgs_cache/Leonardo6_memecap/img_00000013.jpg,When you saying their cat moves much more quickly to answer them when they call it with a...,sarcastic-meme
dataset/_imgs_cache/Leonardo6_memecap/img_00000014.jpg,When you expresses a total weakness,sarcastic-meme
dataset/_imgs_cache/Leonardo6_memecap/img_00000015.jpg,When you expressing distress over the wildfires in Australia,sarcastic-meme
dataset/_imgs_cache/Leonardo6_memecap/img_00000016.jpg,When you gets mad when the person use toilet then water level will be increase only,sarcastic-meme
dataset/_imgs_cache/Leonardo6_memecap/img_00000017.jpg,When you saying the new modern TVs are lightweight but very fragile and might break if not handled...,sarcastic-meme
dataset/_imgs_cache/Leonardo6_memecap/img_00000018.jpg,"When you amused because his mom tells him to just pause his video games, so he's telling her...",sarcastic-meme
dataset/_imgs_cache/Leonardo6_memecap/img_00000019.jpg,When you trying to convey there was a huge storm with gangnam style in 2012 society,sarcastic-meme
dataset/_imgs_cache/Leonardo6_memecap/img_00000020.jpg,When you very proud of their contribution to a streamer,sarcastic-meme
dataset/_imgs_cache/Leonardo6_memecap/img_00000021.jpg,When you thinks the teacher always makes copies of their nice easy to read originals that are dark...,sarcastic-meme
dataset/_imgs_cache/Leonardo6_memecap/img_00000022.jpg,"When you making fun of how vegans say their diet is unhealthy and unnatural for dogs, but not...",sarcastic-meme
dataset/_imgs_cache/Leonardo6_memecap/img_00000023.jpg,When you praising the child for helping the pizza delivery man feel better,sarcastic-meme
dataset/_imgs_cache/Leonardo6_memecap/img_00000024.jpg,When you expresses dislikes in handling certain things,sarcastic-meme
dataset/_imgs_cache/Leonardo6_memecap/img_00000025.jpg,When you trying to convey that women don't want to hear about his story about a scientist turning...,sarcastic-meme
dataset/_imgs_cache/Leonardo6_memecap/img_00000026.jpg,When you making fun of snake charmers,sarcastic-meme
dataset/_imgs_cache/Leonardo6_memecap/img_00000027.jpg,When you thinks it's funny that God would create a creature with thousands of legs and absolutely no...,sarcastic-meme
dataset/_imgs_cache/Leonardo6_memecap/img_00000028.jpg,When youthinks all religion is toxic,sarcastic-meme
dataset/_imgs_cache/Leonardo6_memecap/img_00000029.jpg,When you conveying the message that people keep their distance away,sarcastic-meme
dataset/_imgs_cache/Leonardo6_memecap/img_00000030.jpg,When you not phased by the earthquake they experienced,sarcastic-meme
dataset/_imgs_cache/Leonardo6_memecap/img_00000031.jpg,The person is saying they will literally break their house apart to uphold their archaelogist status,sarcastic-meme
dataset/_imgs_cache/Leonardo6_memecap/img_00000032.jpg,The poster is commenting on the person who predicted that the world would end in 2012 and how...,sarcastic-meme
dataset/_imgs_cache/Leonardo6_memecap/img_00000033.jpg,The poster is trying to figure out why the meme won't die and is still around like the...,sarcastic-meme
dataset/_imgs_cache/Leonardo6_memecap/img_00000034.jpg,When you conveying the government has another week of quarantine in store for them and is not planning...,sarcastic-meme
dataset/_imgs_cache/Leonardo6_memecap/img_00000035.jpg,When you feels the freedom about the end of lockdown,sarcastic-meme
dataset/_imgs_cache/Leonardo6_memecap/img_00000036.jpg,When you gets annoyed Dolphin return to Japan,sarcastic-meme
dataset/_imgs_cache/Leonardo6_memecap/img_00000037.jpg,When you couldn't believe that Queen Elizabeth was still alive when they made the meme,sarcastic-meme
dataset/_imgs_cache/Leonardo6_memecap/img_00000038.jpg,"The poster is saying that since Freddie didn't care about his image, he would have wanted crazy images...",sarcastic-meme
dataset/_imgs_cache/Leonardo6_memecap/img_00000039.jpg,"When you just giving their take on how depressing they feel the world is, so depressing that the...",sarcastic-meme
dataset/_imgs_cache/Leonardo6_memecap/img_00000040.jpg,"When you feeling lazy about going to work, but would get up to go to a fictional chocolate...",sarcastic-meme
dataset/_imgs_cache/Leonardo6_memecap/img_00000041.jpg,When you trying to convey that people suddenly realize that some low-skilled positions are essential to the functioning...,sarcastic-meme
dataset/_imgs_cache/Leonardo6_memecap/img_00000042.jpg,When you more concerned with getting free pizza than the world ending,sarcastic-meme
dataset/_imgs_cache/Leonardo6_memecap/img_00000043.jpg,When you making fun of their own fear of ghosts,sarcastic-meme
dataset/_imgs_cache/Leonardo6_memecap/img_00000044.jpg,When you making fun of North Korea and their propaganda,sarcastic-meme
dataset/_imgs_cache/Leonardo6_memecap/img_00000045.jpg,This post express the young man runs away from another person who is levitating behind him,sarcastic-meme
dataset/_imgs_cache/Leonardo6_memecap/img_00000046.jpg,When you conveying social media sites focus their attention on minor content violations of individual content providers and...,sarcastic-meme
dataset/_imgs_cache/Leonardo6_memecap/img_00000047.jpg,The person is saying that they slept for most of the day because they stayed up all night,sarcastic-meme
dataset/_imgs_cache/Leonardo6_memecap/img_00000048.jpg,When you thinks the reason of the girl being pissed doesn't make sense,sarcastic-meme
dataset/_imgs_cache/Leonardo6_memecap/img_00000049.jpg,When you using toilets getting destroyed to express their dislike for war,sarcastic-meme
dataset/_imgs_cache/Leonardo6_memecap/img_00000050.jpg,The meme poster proved the naysayers wrong and is enjoying success from their art degree,sarcastic-meme
dataset/_imgs_cache/Leonardo6_memecap/img_00000051.jpg,When you waiting for the add for the new game,sarcastic-meme
dataset/_imgs_cache/Leonardo6_memecap/img_00000052.jpg,When you amused because their family can't use the wifi when they're downloading a large file,sarcastic-meme
dataset/_imgs_cache/Leonardo6_memecap/img_00000053.jpg,"When you annoyed when teachers give the class something boring to do, but tell the class to have...",sarcastic-meme
dataset/_imgs_cache/Leonardo6_memecap/img_00000054.jpg,When you implying that the Leaning Tower of Piza would fall without tourists,sarcastic-meme
dataset/_imgs_cache/Leonardo6_memecap/img_00000055.jpg,"When you gets nudes from a girl, but he wanted pictures of Spiderman",sarcastic-meme
dataset/_imgs_cache/Leonardo6_memecap/img_00000056.jpg,When you concerned about what they see of Americans behavior,sarcastic-meme
dataset/_imgs_cache/Leonardo6_memecap/img_00000057.jpg,When you honored,sarcastic-meme
dataset/_imgs_cache/Leonardo6_memecap/img_00000058.jpg,When you scolds Jake Paul and his family for getting arrested by the police,sarcastic-meme
dataset/_imgs_cache/Leonardo6_memecap/img_00000059.jpg,When you trying to convey that reaction of disaster of 2020,sarcastic-meme
dataset/_imgs_cache/Leonardo6_memecap/img_00000060.jpg,When you having flashbacks of what a disaster the year 2020 was,sarcastic-meme
dataset/_imgs_cache/Leonardo6_memecap/img_00000061.jpg,When you thinks the medical beliefs and prescriptions of the 19th century seem insane to our modern understanding,sarcastic-meme
dataset/_imgs_cache/Leonardo6_memecap/img_00000062.jpg,Mene poster is shocked that sales were skyrocketed despite intended meaning from finding nemo,sarcastic-meme
dataset/_imgs_cache/Leonardo6_memecap/img_00000063.jpg,When you wants Reddit to stop recommending him live broadcasts,sarcastic-meme
dataset/_imgs_cache/Leonardo6_memecap/img_00000064.jpg,When you scared when toilet starts rising after flusing the toilet,sarcastic-meme
dataset/_imgs_cache/Leonardo6_memecap/img_00000065.jpg,When you amused by the fact that you can go to jail or win a prize for building...,sarcastic-meme
dataset/_imgs_cache/Leonardo6_memecap/img_00000066.jpg,When you mad that the dialogue in movies is always softer than the very loud action scenes,sarcastic-meme
dataset/_imgs_cache/Leonardo6_memecap/img_00000067.jpg,When you apprentices diligence with a promotion,sarcastic-meme
dataset/_imgs_cache/Leonardo6_memecap/img_00000068.jpg,Poster thinks Flash's bike is not a useful accessory for a super hero,sarcastic-meme
dataset/_imgs_cache/Leonardo6_memecap/img_00000069.jpg,When you thinks Apple's new microphone technology is going to expose their bad behavior to the public,sarcastic-meme
dataset/_imgs_cache/Leonardo6_memecap/img_00000070.jpg,When you trying to convey the disappointment they feel in not getting to learn what they want to...,sarcastic-meme
dataset/_imgs_cache/Leonardo6_memecap/img_00000071.jpg,When you thinks students are aware they are unprepared because of covid,sarcastic-meme
dataset/_imgs_cache/Leonardo6_memecap/img_00000072.jpg,When you conveying that the first grader wishing the rain away makes the shaman want to destroy them,sarcastic-meme
dataset/_imgs_cache/Leonardo6_memecap/img_00000073.jpg,When you trying to convey that their father's coworkers appreciate his jokes more than his family does,sarcastic-meme
dataset/_imgs_cache/Leonardo6_memecap/img_00000074.jpg,When you joking about how humans win Miss Universe over aliens every time,sarcastic-meme
dataset/_imgs_cache/Leonardo6_memecap/img_00000075.jpg,When you thinks farting in online class is still embarrassing,sarcastic-meme
dataset/_imgs_cache/Leonardo6_memecap/img_00000076.jpg,When you trying to convey how their relationships with other bumper car drivers evolve over time,sarcastic-meme
dataset/_imgs_cache/Leonardo6_memecap/img_00000077.jpg,Poster was not aware of first person perspective,sarcastic-meme
dataset/_imgs_cache/Leonardo6_memecap/img_00000078.jpg,When you annoyed at other's constant reddit presense,sarcastic-meme
dataset/_imgs_cache/Leonardo6_memecap/img_00000079.jpg,"When you conveying the way that introverts have complex emotions following the completion of a phone call, that...",sarcastic-meme
dataset/_imgs_cache/Leonardo6_memecap/img_00000080.jpg,When you trying to convey that they can never seem to get the television too loud or too...,sarcastic-meme
dataset/_imgs_cache/Leonardo6_memecap/img_00000081.jpg,When you trying to convey that Covid-19 will likely never be over until its to late to do...,sarcastic-meme
dataset/_imgs_cache/Leonardo6_memecap/img_00000082.jpg,When you imagining that the phrase 'an apple a day keeps the doctor away' is actually true and...,sarcastic-meme
dataset/_imgs_cache/Leonardo6_memecap/img_00000083.jpg,When you impressed with Quantas aeronautical maneuvering,sarcastic-meme
dataset/_imgs_cache/Leonardo6_memecap/img_00000084.jpg,"When you trying to convey Kid doesnt care what parents decide for him, he will do his own...",sarcastic-meme
dataset/_imgs_cache/Leonardo6_memecap/img_00000085.jpg,When you trying to convey how funny it is that the man who named Cars II got such...,sarcastic-meme
dataset/_imgs_cache/Leonardo6_memecap/img_00000086.jpg,When you trying to convey confusion over the flat-earth theory,sarcastic-meme
dataset/_imgs_cache/Leonardo6_memecap/img_00000087.jpg,When you trying to convey that cats offer dead rats as gifts even when no one wants it,sarcastic-meme
dataset/_imgs_cache/Leonardo6_memecap/img_00000088.jpg,When you trying to convey that they can't get Reddit memes out of their head,sarcastic-meme
dataset/_imgs_cache/Leonardo6_memecap/img_00000089.jpg,The nasa employee is smug about his score,sarcastic-meme
dataset/_imgs_cache/Leonardo6_memecap/img_00000090.jpg,When you only is lowkey into to eat potatoes when they are mashed,sarcastic-meme
dataset/_imgs_cache/Leonardo6_memecap/img_00000091.jpg,When you sees funny name on the receipt and decides to do the same,sarcastic-meme
dataset/_imgs_cache/Leonardo6_memecap/img_00000092.jpg,When you trying to convey that many of them using the same meme plates in different ways,sarcastic-meme
dataset/_imgs_cache/Leonardo6_memecap/img_00000093.jpg,When you trying to convey that the down bad feeling about the black cats,sarcastic-meme
dataset/_imgs_cache/Leonardo6_memecap/img_00000094.jpg,When you trying to convey how their teeth looked before and after getting braces,sarcastic-meme
dataset/_imgs_cache/Leonardo6_memecap/img_00000095.jpg,When you trying to convey how popular Leonardo DiCaprio images are for memes,sarcastic-meme
dataset/_imgs_cache/Leonardo6_memecap/img_00000096.jpg,"When you trying to convey that americans are scared of being tracked by vaccines, but will carry a...",sarcastic-meme
dataset/_imgs_cache/Leonardo6_memecap/img_00000097.jpg,When you feels bad they used all their mom's shampoo on themselves,sarcastic-meme
dataset/_imgs_cache/Leonardo6_memecap/img_00000098.jpg,When you trying to convey that random images of people can be used to convey a conversation,sarcastic-meme
dataset/_imgs_cache/Leonardo6_memecap/img_00000099.jpg,When you sees a online fight about what having a phone flipped over means and wants it to...,sarcastic-meme
dataset/_imgs_cache/Leonardo6_memecap/img_00000100.jpg,When you gets mad when the man see the laptop while being woman,sarcastic-meme
dataset/_imgs_cache/Leonardo6_memecap/img_00000101.jpg,When you tries to perfection of his work,sarcastic-meme
dataset/_imgs_cache/Leonardo6_memecap/img_00000102.jpg,When you trying to convey that their underage drinking at the bar is the least of their family's...,sarcastic-meme
dataset/_imgs_cache/Leonardo6_memecap/img_00000103.jpg,When you showing what it is like when you recognize someone from your town on television,sarcastic-meme
dataset/_imgs_cache/Leonardo6_memecap/img_00000104.jpg,When you trying to convey that how socialised people treating,sarcastic-meme
dataset/_imgs_cache/Leonardo6_memecap/img_00000105.jpg,When you glad they contributed something to the party,sarcastic-meme
dataset/_imgs_cache/Leonardo6_memecap/img_00000106.jpg,When you trying to convey that shampoo bottles make a louder sound when they fall then soap,sarcastic-meme
dataset/_imgs_cache/Leonardo6_memecap/img_00000107.jpg,When you trying to convey that even psychopaths and serial killers are terrified of people who don't use...,sarcastic-meme
dataset/_imgs_cache/Leonardo6_memecap/img_00000108.jpg,When you trying to convey that they're excited about the new Reddit update,sarcastic-meme
dataset/_imgs_cache/Leonardo6_memecap/img_00000109.jpg,When you feels wide awake in the morning after staying up all night but quickly fades at 11...,sarcastic-meme
dataset/_imgs_cache/Leonardo6_memecap/img_00000110.jpg,This meme poster explains the time when I forget my girlfriend in front of me,sarcastic-meme
dataset/_imgs_cache/Leonardo6_memecap/img_00000111.jpg,When you trying to convey the scared moment when you parents return home and you have to stop...,sarcastic-meme
dataset/_imgs_cache/Leonardo6_memecap/img_00000112.jpg,When you saying that these set of superheroes don't kill people but put them in the hospital,sarcastic-meme
dataset/_imgs_cache/Leonardo6_memecap/img_00000113.jpg,When you trying to convey that millennials all look old and down bad now because we have survived...,sarcastic-meme
dataset/_imgs_cache/Leonardo6_memecap/img_00000114.jpg,When you trying to convey that a phoenix is reborn from the ashes so its not a big...,sarcastic-meme
dataset/_imgs_cache/Leonardo6_memecap/img_00000115.jpg,When you envious of how good life must have been for people before Reddit was invented,sarcastic-meme
dataset/_imgs_cache/Leonardo6_memecap/img_00000116.jpg,When you trying to convey that a person shoots another man for making a pun joke about Switzerland's...,sarcastic-meme
dataset/_imgs_cache/Leonardo6_memecap/img_00000117.jpg,When you trying to convey that they put candy bar wrappers in their pocket instead of littering,sarcastic-meme
dataset/_imgs_cache/Leonardo6_memecap/img_00000118.jpg,When you trying to convey the pain you show when you learn your parents committed a blasphemous act,sarcastic-meme
dataset/_imgs_cache/Leonardo6_memecap/img_00000119.jpg,When you trying to get better and improve,sarcastic-meme
dataset/_imgs_cache/Leonardo6_memecap/img_00000120.jpg,When you trying to convey that sometimes we write things we don't mean,sarcastic-meme
dataset/_imgs_cache/Leonardo6_memecap/img_00000121.jpg,When you trying to convey that Thanos sees the woman is wearing the infinity stones and wants it,sarcastic-meme
dataset/_imgs_cache/Leonardo6_memecap/img_00000122.jpg,When you trying to convey he is as impressed with helicopters now as he was as a kid,sarcastic-meme
dataset/_imgs_cache/Leonardo6_memecap/img_00000123.jpg,The poster upvotes Among Us memes even though they don't play,sarcastic-meme
dataset/_imgs_cache/Leonardo6_memecap/img_00000124.jpg,When you suspicious about quantity of hands,sarcastic-meme
dataset/_imgs_cache/Leonardo6_memecap/img_00000125.jpg,The meme illustrates a funny point about using legendary equipment in modern times,sarcastic-meme
dataset/_imgs_cache/Leonardo6_memecap/img_00000126.jpg,When you trying to convey that movie rescue scenes are always the same,sarcastic-meme
dataset/_imgs_cache/Leonardo6_memecap/img_00000127.jpg,When you trying to convey the depressed people is multi types,sarcastic-meme
dataset/_imgs_cache/Leonardo6_memecap/img_00000128.jpg,When you trying to convey that the conversation between father and son about sons test results,sarcastic-meme
dataset/_imgs_cache/Leonardo6_memecap/img_00000129.jpg,When you trying to convey that people don't have a moral values,sarcastic-meme
dataset/_imgs_cache/Leonardo6_memecap/img_00000130.jpg,When you trying to convey that Pokemon are cute when they are small and progress to bigger and...,sarcastic-meme
dataset/_imgs_cache/Leonardo6_memecap/img_00000131.jpg,When you trying to convey that old video game systems have impressive battery life,sarcastic-meme
dataset/_imgs_cache/Leonardo6_memecap/img_00000132.jpg,Poster thinks Harry Potter placed his admiration on the wrong people,sarcastic-meme
dataset/_imgs_cache/Leonardo6_memecap/img_00000133.jpg,When you thinks it would be a completely overwhelming and incredible experience to see your game go viral...,sarcastic-meme
dataset/_imgs_cache/Leonardo6_memecap/img_00000134.jpg,When you trying to convey that the kid drowning in the chocolate river are often ignored in the...,sarcastic-meme
dataset/_imgs_cache/Leonardo6_memecap/img_00000135.jpg,When you unreasonably happy to keep his old tv that won't support the graphics on his new PS5,sarcastic-meme
dataset/_imgs_cache/Leonardo6_memecap/img_00000136.jpg,When you excited to stop any other non-Halloween memes on Oct,sarcastic-meme
dataset/_imgs_cache/Leonardo6_memecap/img_00000137.jpg,When you trying to convey that Google's search results are more high quality than Bing's,sarcastic-meme
dataset/_imgs_cache/Leonardo6_memecap/img_00000138.jpg,When you finds the difference between the violence of dragons in Western myths and the serene beauty of...,sarcastic-meme
dataset/_imgs_cache/Leonardo6_memecap/img_00000139.jpg,When you trying to convey that it's really easy to find the thieves guild hideout,sarcastic-meme
dataset/_imgs_cache/Leonardo6_memecap/img_00000140.jpg,When you trying to figure out how much sleep he'll get if they continue to watch tv,sarcastic-meme
dataset/_imgs_cache/Leonardo6_memecap/img_00000141.jpg,The poster got what he wanted at the stand because the kid knew he would want it,sarcastic-meme
dataset/_imgs_cache/Leonardo6_memecap/img_00000142.jpg,When you trying to convey that random things are the only thing to stop cartoon characters from dying,sarcastic-meme
dataset/_imgs_cache/Leonardo6_memecap/img_00000143.jpg,When you trying to convey that the kid with weird mustache in class refuses to shave it off...,sarcastic-meme
dataset/_imgs_cache/Leonardo6_memecap/img_00000144.jpg,When you trying to convey that everything in Japan is smaller,sarcastic-meme
dataset/_imgs_cache/Leonardo6_memecap/img_00000145.jpg,When you trying to convey that their brother blew their mind with math problems when they were little,sarcastic-meme
dataset/_imgs_cache/Leonardo6_memecap/img_00000146.jpg,"When you jokes that being in a time zone which is 'ahead' is like time travel, so provides...",sarcastic-meme
dataset/_imgs_cache/Leonardo6_memecap/img_00000147.jpg,When you enjoys Spotify suggestions on the rare occasions they are good and is always surprised when he...,sarcastic-meme
dataset/_imgs_cache/Leonardo6_memecap/img_00000148.jpg,"When you was relieved that he didn't blurt out the wrong answer, thus not making himself look dumb",sarcastic-meme
dataset/_imgs_cache/Leonardo6_memecap/img_00000149.jpg,When you trying to convey that they write about politics from areas of the world they know little...,sarcastic-meme
dataset/_imgs_cache/Leonardo6_memecap/img_00000150.jpg,When you thinks that gamers think video game lore has deep meanings attached when the developers actually didn't...,sarcastic-meme
dataset/_imgs_cache/Leonardo6_memecap/img_00000151.jpg,When you thinks that the teacher is frustrated at student for using phone in class,sarcastic-meme
dataset/_imgs_cache/Leonardo6_memecap/img_00000152.jpg,When you trying to convey that be aware of your surroundings,sarcastic-meme
dataset/_imgs_cache/Leonardo6_memecap/img_00000153.jpg,When you trying to convey that Pennsylvania will become the most iconic state,sarcastic-meme
dataset/_imgs_cache/Leonardo6_memecap/img_00000154.jpg,"When you trying to convey that Banks only want profit, they don't care about foreclosed pesons",sarcastic-meme
dataset/_imgs_cache/Leonardo6_memecap/img_00000155.jpg,When you trying to convey that all highways in the Midwest look the same,sarcastic-meme
dataset/_imgs_cache/Leonardo6_memecap/img_00000156.jpg,When you trying to convey how fathers who don't want pets are the ones who become the most...,sarcastic-meme
dataset/_imgs_cache/Leonardo6_memecap/img_00000157.jpg,When you trying to convey that internet users are mad YouTube went down,sarcastic-meme
dataset/_imgs_cache/Leonardo6_memecap/img_00000158.jpg,When you trying to convey that artist creation causes earth to split in half,sarcastic-meme
dataset/_imgs_cache/Leonardo6_memecap/img_00000159.jpg,When you trying to convey that a non-english speaking European and talk with a British or American accent...,sarcastic-meme
dataset/_imgs_cache/Leonardo6_memecap/img_00000160.jpg,"When you trying to convey that despite making a username he thought he was cool at 12, it's...",sarcastic-meme
dataset/_imgs_cache/Leonardo6_memecap/img_00000161.jpg,When you trying to convey that a man throws baby out the window after learning the mom is...,sarcastic-meme
dataset/_imgs_cache/Leonardo6_memecap/img_00000162.jpg,When you amused baby elephant is unstealthy,sarcastic-meme
dataset/_imgs_cache/Leonardo6_memecap/img_00000163.jpg,When you trying to convey that water molecules are frozen and not frozen in such small temperature differences,sarcastic-meme
dataset/_imgs_cache/Leonardo6_memecap/img_00000164.jpg,When you trying to convey that three figures with the same last name realize one of them are...,sarcastic-meme
dataset/_imgs_cache/Leonardo6_memecap/img_00000165.jpg,When you trying to convey that Draco puts extra emphasis on the P sound when saying Potter,sarcastic-meme
dataset/_imgs_cache/Leonardo6_memecap/img_00000166.jpg,When you making a joke about how in the lion king movie something terrible happens to simba and...,sarcastic-meme
dataset/_imgs_cache/Leonardo6_memecap/img_00000167.jpg,When you trying to convey that even calculators need help when asked to do difficult math problems,sarcastic-meme
dataset/_imgs_cache/Leonardo6_memecap/img_00000168.jpg,When you running to check out their new shoes in the store,sarcastic-meme
dataset/_imgs_cache/Leonardo6_memecap/img_00000169.jpg,When you trying to convey that the fireplace he makes irritates his eyes no matter what,sarcastic-meme
dataset/_imgs_cache/Leonardo6_memecap/img_00000170.jpg,"When you insulting the reader using a 'your mom' joke, saying that the reader's mother would be unable...",sarcastic-meme
dataset/_imgs_cache/Leonardo6_memecap/img_00000171.jpg,When you trying to convey that Dumbledore will always award point to Gryffindor,sarcastic-meme
