image_path,caption,style
dataset/_imgs_cache/Leonardo6_memecap/img_00001349.jpg,When you trying to convey that Subscription company owners do not want customers to be able to own...,sarcastic-meme
dataset/_imgs_cache/Leonardo6_memecap/img_00001350.jpg,"The poster is saying that they can put everything in one pocket, but only their phone in the...",sarcastic-meme
dataset/_imgs_cache/Leonardo6_memecap/img_00001351.jpg,When you trying to convey that They hate elaborate corporate ads and wish to destroy them,sarcastic-meme
dataset/_imgs_cache/Leonardo6_memecap/img_00001352.jpg,The poster is making fun of a song,sarcastic-meme
dataset/_imgs_cache/Leonardo6_memecap/img_00001353.jpg,When you making fun of a poster trying to shock about how big a banana is,sarcastic-meme
dataset/_imgs_cache/Leonardo6_memecap/img_00001354.jpg,"When you feels cured of their mental illness and very powerful when they have cleaned their room, while...",sarcastic-meme
dataset/_imgs_cache/Leonardo6_memecap/img_00001355.jpg,When you trying to convey that the confederacy flag that ultimately mattered was their surrender,sarcastic-meme
dataset/_imgs_cache/Leonardo6_memecap/img_00001356.jpg,When you trying to convey that they don't want to miss what they try to hit,sarcastic-meme
dataset/_imgs_cache/Leonardo6_memecap/img_00001357.jpg,When you trying to convey that there is nothing like the first time they put their USB in...,sarcastic-meme
dataset/_imgs_cache/Leonardo6_memecap/img_00001358.jpg,When you trying to convey that Guys opening themselves up to let the shower water rinse all over...,sarcastic-meme
dataset/_imgs_cache/Leonardo6_memecap/img_00001359.jpg,"When you pretending to feel good, despite being hungry, thirsty, and sleep-deprived",sarcastic-meme
dataset/_imgs_cache/Leonardo6_memecap/img_00001360.jpg,When you trying to convey that they get personally pissed when people insult Reddit,sarcastic-meme
dataset/_imgs_cache/Leonardo6_memecap/img_00001361.jpg,When you trying to convey that monotheist argue too much about gods while Japan has a practical way...,sarcastic-meme
dataset/_imgs_cache/Leonardo6_memecap/img_00001362.jpg,When you thinks it's funny to kill lactose intolerant people because they can't eat cheese,sarcastic-meme
dataset/_imgs_cache/Leonardo6_memecap/img_00001363.jpg,When you trying to convey that he represents Spongebob as a single lonely adult man,sarcastic-meme
dataset/_imgs_cache/Leonardo6_memecap/img_00001364.jpg,Poster thinks vapers sometimes take big hits,sarcastic-meme
dataset/_imgs_cache/Leonardo6_memecap/img_00001365.jpg,When you trying to convey that they like Latina Milfs and wish to have sex with them,sarcastic-meme
dataset/_imgs_cache/Leonardo6_memecap/img_00001366.jpg,When you trying to convey that Nintendo doesn't make good deals even on Black Friday,sarcastic-meme
dataset/_imgs_cache/Leonardo6_memecap/img_00001367.jpg,When you making a joke using the way that the name of the poet Edgar Allan Poe can...,sarcastic-meme
dataset/_imgs_cache/Leonardo6_memecap/img_00001368.jpg,When you thinks that users of Mastodon have made the right choice to leave Twitter and will have...,sarcastic-meme
dataset/_imgs_cache/Leonardo6_memecap/img_00001369.jpg,"When you a beginner at the game but is beating their supposedly more skilled friends, which makes them...",sarcastic-meme
dataset/_imgs_cache/Leonardo6_memecap/img_00001370.jpg,When you trying to convey that they can't remember the lines to their presentation,sarcastic-meme
dataset/_imgs_cache/Leonardo6_memecap/img_00001371.jpg,When you trying to convey that talking to your teachers about their day will give you good results,sarcastic-meme
dataset/_imgs_cache/Leonardo6_memecap/img_00001372.jpg,When you intends to kill the fly that is buzzing in their room,sarcastic-meme
dataset/_imgs_cache/Leonardo6_memecap/img_00001373.jpg,Poster admist to putting little effort into his own birthday,sarcastic-meme
dataset/_imgs_cache/Leonardo6_memecap/img_00001374.jpg,When you trying to convey that the paper the dog ate were important to the meme poster to...,sarcastic-meme
dataset/_imgs_cache/Leonardo6_memecap/img_00001375.jpg,When you trying to convey a calm mind,sarcastic-meme
dataset/_imgs_cache/Leonardo6_memecap/img_00001376.jpg,When you trying to convey that reddit admin decides to add nfts instead of trying to improve the...,sarcastic-meme
dataset/_imgs_cache/Leonardo6_memecap/img_00001377.jpg,"When you exhausted after minimal,y cleaning room",sarcastic-meme
dataset/_imgs_cache/Leonardo6_memecap/img_00001378.jpg,When you trying to convey that Valve doesn't do anything with their popular IPs,sarcastic-meme
dataset/_imgs_cache/Leonardo6_memecap/img_00001379.jpg,When you trying to convey that they prefer Reddit over TikTok and Instagram,sarcastic-meme
dataset/_imgs_cache/Leonardo6_memecap/img_00001380.jpg,They hate to be restrained by class in rpgs,sarcastic-meme
dataset/_imgs_cache/Leonardo6_memecap/img_00001381.jpg,When you would get into a storm drain with Pennywise just to avoid political ads,sarcastic-meme
dataset/_imgs_cache/Leonardo6_memecap/img_00001382.jpg,When you trying to convey that Walter White has become a ranger and now has law enforcement powers...,sarcastic-meme
dataset/_imgs_cache/Leonardo6_memecap/img_00001383.jpg,When you trying to convey that Epic games is just for free video games that might be played,sarcastic-meme
dataset/_imgs_cache/Leonardo6_memecap/img_00001384.jpg,When you trying to convey a joke about a doctor having to draw blood and then literally drawing...,sarcastic-meme
dataset/_imgs_cache/Leonardo6_memecap/img_00001385.jpg,"When you trying to convey that A Redditr may enjoy seeing Twitter melting down, but the former Twitters...",sarcastic-meme
dataset/_imgs_cache/Leonardo6_memecap/img_00001386.jpg,"When you trying to convey that they're so lonely, they'll seek affection from a tree",sarcastic-meme
dataset/_imgs_cache/Leonardo6_memecap/img_00001387.jpg,When you expresses the irony of him finding humans snoring incredibly annoying but when his pet snores he...,sarcastic-meme
dataset/_imgs_cache/Leonardo6_memecap/img_00001388.jpg,When you conveying the face of being not guilty after doing something guilty,sarcastic-meme
dataset/_imgs_cache/Leonardo6_memecap/img_00001389.jpg,When you conveying that When people become famous they must decide to become either a pedophile or racist,sarcastic-meme
dataset/_imgs_cache/Leonardo6_memecap/img_00001390.jpg,When you wants to watch a movie so his mom gives him the faith based version instead of...,sarcastic-meme
dataset/_imgs_cache/Leonardo6_memecap/img_00001391.jpg,"When you trying to convey that New burger places all have bad tasting too fancy burgers, hipster chefs,...",sarcastic-meme
dataset/_imgs_cache/Leonardo6_memecap/img_00001392.jpg,When you trying to convey that they tried to be like One Punch Man but now they developed...,sarcastic-meme
dataset/_imgs_cache/Leonardo6_memecap/img_00001393.jpg,When you trying to convey that Schools do little about bullying according to poster,sarcastic-meme
dataset/_imgs_cache/Leonardo6_memecap/img_00001394.jpg,Poster thinks nightmares are compatible to horror movies,sarcastic-meme
dataset/_imgs_cache/Leonardo6_memecap/img_00001395.jpg,When you trying to convey that their weekend is going to be trash,sarcastic-meme
dataset/_imgs_cache/Leonardo6_memecap/img_00001396.jpg,"When you trying to convey that they're still the butt of ""your mom"" jokes, despite having two dads",sarcastic-meme
dataset/_imgs_cache/Leonardo6_memecap/img_00001397.jpg,When you trying to convey that introverts all want the superpower of invisibility,sarcastic-meme
dataset/_imgs_cache/Leonardo6_memecap/img_00001398.jpg,When you trying to convey that they're fed up with people being crucified over semantic on Twitter,sarcastic-meme
dataset/_imgs_cache/Leonardo6_memecap/img_00001399.jpg,When you trying to convey that Twitter uses who threaten to quit the platform and don't are annoying,sarcastic-meme
dataset/_imgs_cache/Leonardo6_memecap/img_00001400.jpg,Poster thinks discord mods are overweight,sarcastic-meme
dataset/_imgs_cache/Leonardo6_memecap/img_00001401.jpg,When you trying to convey that All the meme poster's testosterone is going to their body hair and...,sarcastic-meme
dataset/_imgs_cache/Leonardo6_memecap/img_00001402.jpg,When you trying to convey that Teachers are mad when they shouldn't be and care about the wrong...,sarcastic-meme
dataset/_imgs_cache/Leonardo6_memecap/img_00001403.jpg,When you realizing their life was a lie,sarcastic-meme
dataset/_imgs_cache/Leonardo6_memecap/img_00001404.jpg,When you and society see Elon Musk as the stock market god,sarcastic-meme
dataset/_imgs_cache/Leonardo6_memecap/img_00001405.jpg,When you conveying that it will make the store busy,sarcastic-meme
dataset/_imgs_cache/Leonardo6_memecap/img_00001406.jpg,When you trying to convey that Life was simpler when you were a kid and as you get...,sarcastic-meme
dataset/_imgs_cache/Leonardo6_memecap/img_00001407.jpg,The poster is stating that people always open things if they aren't supposed to,sarcastic-meme
dataset/_imgs_cache/Leonardo6_memecap/img_00001408.jpg,When you trying to convey that they don't think psychology majors should be depressed,sarcastic-meme
dataset/_imgs_cache/Leonardo6_memecap/img_00001409.jpg,When you trying to convey that Woman is big mad that the man didn't understand her confusing signals,sarcastic-meme
dataset/_imgs_cache/Leonardo6_memecap/img_00001410.jpg,"When you trying to convey that the speaker is making good intentions, but Xavier interprets it in a...",sarcastic-meme
dataset/_imgs_cache/Leonardo6_memecap/img_00001411.jpg,When you trying to convey that the luigi character has a funny-shaped face,sarcastic-meme
dataset/_imgs_cache/Leonardo6_memecap/img_00001412.jpg,When you trying to convey that they think most people act like clowns,sarcastic-meme
dataset/_imgs_cache/Leonardo6_memecap/img_00001413.jpg,When you trying to convey that Man is excited to go to a island with a childish name,sarcastic-meme
dataset/_imgs_cache/Leonardo6_memecap/img_00001414.jpg,A humorous meme poster illustrates the point about time and money,sarcastic-meme
dataset/_imgs_cache/Leonardo6_memecap/img_00001415.jpg,When you trying to convey that their neighbors get destructive over parking spots,sarcastic-meme
dataset/_imgs_cache/Leonardo6_memecap/img_00001416.jpg,When you trying to convey that the People's jealousy about the people who is partying at whole night,sarcastic-meme
dataset/_imgs_cache/Leonardo6_memecap/img_00001417.jpg,When you trying to convey that Kids grew up playing on crazy and dangerous playgrounds now will climb...,sarcastic-meme
dataset/_imgs_cache/Leonardo6_memecap/img_00001418.jpg,When you showing that Markiplier is too big to be affected by people avoiding his content,sarcastic-meme
dataset/_imgs_cache/Leonardo6_memecap/img_00001419.jpg,When you trying to convey that they just want to sleep instead of watching their friends party,sarcastic-meme
dataset/_imgs_cache/Leonardo6_memecap/img_00001420.jpg,When you trying to convey that Mascots were the first version of furries,sarcastic-meme
dataset/_imgs_cache/Leonardo6_memecap/img_00001421.jpg,When you trying to convey that most rappers who talk about street life are sellouts who live in...,sarcastic-meme
dataset/_imgs_cache/Leonardo6_memecap/img_00001422.jpg,When you thinking about different transportation methods and comes up with the best one,sarcastic-meme
dataset/_imgs_cache/Leonardo6_memecap/img_00001423.jpg,When you trying to convey that enjoying his holiday with sunbath,sarcastic-meme
dataset/_imgs_cache/Leonardo6_memecap/img_00001424.jpg,When you trying to convey that the delivery guy misinterpreted it as just putting one pepperoni on the...,sarcastic-meme
dataset/_imgs_cache/Leonardo6_memecap/img_00001425.jpg,When you shocked when the police come in when he is doing illegal activity,sarcastic-meme
dataset/_imgs_cache/Leonardo6_memecap/img_00001426.jpg,When you wonders what video games Abraham Lincoln would play if he had a YouTube channel,sarcastic-meme
dataset/_imgs_cache/Leonardo6_memecap/img_00001427.jpg,When you gets annoyed by seeing the reply comment to his old comment on his post,sarcastic-meme
dataset/_imgs_cache/Leonardo6_memecap/img_00001428.jpg,When you shocked to learn that horses have such small horsepower,sarcastic-meme
dataset/_imgs_cache/Leonardo6_memecap/img_00001429.jpg,When you very pissed with their spouse for cutting their pizza with a scissors,sarcastic-meme
dataset/_imgs_cache/Leonardo6_memecap/img_00001430.jpg,When you trying to convey that Football fans in the north are stupid,sarcastic-meme
dataset/_imgs_cache/Leonardo6_memecap/img_00001431.jpg,When you trying to convey that he looks confused about how r/meme and r/memes are different from each...,sarcastic-meme
dataset/_imgs_cache/Leonardo6_memecap/img_00001432.jpg,When you trying to convey that the person feels unreasonably happy in the death of another person while...,sarcastic-meme
dataset/_imgs_cache/Leonardo6_memecap/img_00001433.jpg,When you trying to convey that Some platforms are more delete friendly than others,sarcastic-meme
dataset/_imgs_cache/Leonardo6_memecap/img_00001434.jpg,When you trying to convey that they are creating new stories about something horror,sarcastic-meme
dataset/_imgs_cache/Leonardo6_memecap/img_00001435.jpg,When you trying to convey that some dreams was horrible,sarcastic-meme
dataset/_imgs_cache/Leonardo6_memecap/img_00001436.jpg,When you trying to convey people are not cleaning well,sarcastic-meme
dataset/_imgs_cache/Leonardo6_memecap/img_00001437.jpg,When you trying to convey that Kid tries to celebrate Christmas too early for his parent's liking,sarcastic-meme
dataset/_imgs_cache/Leonardo6_memecap/img_00001438.jpg,When you trying to convey that Life is a meaningless cycle,sarcastic-meme
dataset/_imgs_cache/Leonardo6_memecap/img_00001439.jpg,When you trying to convey that Today's Americans are lazier than their ancestors who had to walk miles...,sarcastic-meme
dataset/_imgs_cache/Leonardo6_memecap/img_00001440.jpg,When you trying to convey that Everyone is ignoring Johnny Sins cleaning an office plant,sarcastic-meme
dataset/_imgs_cache/Leonardo6_memecap/img_00001441.jpg,When you trying to convey that getting a lot of is lowkey into makes you feel good,sarcastic-meme
dataset/_imgs_cache/Leonardo6_memecap/img_00001442.jpg,When you trying to convey that Parent fined out child had a bad night and crashed a car,sarcastic-meme
dataset/_imgs_cache/Leonardo6_memecap/img_00001443.jpg,When you trying to convey that the student's sorrow,sarcastic-meme
dataset/_imgs_cache/Leonardo6_memecap/img_00001444.jpg,When you trying to convey that Gen Z smashes everything but doesn't want to be associated with boomers...,sarcastic-meme
dataset/_imgs_cache/Leonardo6_memecap/img_00001445.jpg,When you trying to convey that Person teases spiderman about his dead girlfriend,sarcastic-meme
dataset/_imgs_cache/Leonardo6_memecap/img_00001446.jpg,The meme poster sees the consequences of their actions coming towards them,sarcastic-meme
dataset/_imgs_cache/Leonardo6_memecap/img_00001447.jpg,When you tired of seeing Reddit posts about Elon Musk,sarcastic-meme
dataset/_imgs_cache/Leonardo6_memecap/img_00001448.jpg,When you trying to convey that Elon Musk seems like a genius with his other companies but a...,sarcastic-meme
dataset/_imgs_cache/Leonardo6_memecap/img_00001449.jpg,When you trying to convey that The lady looks way older than what is being said,sarcastic-meme
dataset/_imgs_cache/Leonardo6_memecap/img_00001450.jpg,When you trying to convey that the reality of life,sarcastic-meme
dataset/_imgs_cache/Leonardo6_memecap/img_00001451.jpg,"Poster beleives college is for profit gaining, not education advancement",sarcastic-meme
dataset/_imgs_cache/Leonardo6_memecap/img_00001452.jpg,When you feels extreme pain by eating a food that touched his mouth wrong,sarcastic-meme
dataset/_imgs_cache/Leonardo6_memecap/img_00001453.jpg,When you trying to convey that their parents wouldn't have chosen them if they would have adopted,sarcastic-meme
dataset/_imgs_cache/Leonardo6_memecap/img_00001454.jpg,When you makes pun about how ducks could avoid attacks of sucking out their life force,sarcastic-meme
dataset/_imgs_cache/Leonardo6_memecap/img_00001455.jpg,When you trying to convey that artwork is not always pretty as it sounds,sarcastic-meme
dataset/_imgs_cache/Leonardo6_memecap/img_00001456.jpg,When you trying to convey that People associate Jesus with crosses knowing he dies on one,sarcastic-meme
dataset/_imgs_cache/Leonardo6_memecap/img_00001457.jpg,Poster believes sites that allow cookie disabling are superior to those that do not,sarcastic-meme
dataset/_imgs_cache/Leonardo6_memecap/img_00001458.jpg,The poster feels like an idiot because he spent more time doing something than it should have taken...,sarcastic-meme
dataset/_imgs_cache/Leonardo6_memecap/img_00001459.jpg,When you trying to convey that they have ulterior motives for their bleach and alcohol,sarcastic-meme
dataset/_imgs_cache/Leonardo6_memecap/img_00001460.jpg,When you trying to convey that Hungarian grammar is complex compared to some other languages,sarcastic-meme
dataset/_imgs_cache/Leonardo6_memecap/img_00001461.jpg,When you trying to convey that they prefer the early version of Windows,sarcastic-meme
dataset/_imgs_cache/Leonardo6_memecap/img_00001462.jpg,Literally this meme shows speed bump near the playground but then you remember there is no speed bump,sarcastic-meme
dataset/_imgs_cache/Leonardo6_memecap/img_00001463.jpg,When you trying to convey that Some People think anime is geared for kids but it can be...,sarcastic-meme
dataset/_imgs_cache/Leonardo6_memecap/img_00001464.jpg,When you trying to convey that They understand why volcanos happen but are otherwise bothered by them,sarcastic-meme
dataset/_imgs_cache/Leonardo6_memecap/img_00001465.jpg,When you trying to convey that Having to choose between types of blocks is a difficult question,sarcastic-meme
dataset/_imgs_cache/Leonardo6_memecap/img_00001466.jpg,Poster admists to subconscious manipulation on date,sarcastic-meme
dataset/_imgs_cache/Leonardo6_memecap/img_00001467.jpg,When you trying to convey that It is easier to jump in the river in one country compared...,sarcastic-meme
dataset/_imgs_cache/Leonardo6_memecap/img_00001468.jpg,When you doesn't want to see ads on Reddit so they downvote them when they sees them,sarcastic-meme
dataset/_imgs_cache/Leonardo6_memecap/img_00001469.jpg,When you trying to convey that women love people with the complete original set of Pokemon cards,sarcastic-meme
dataset/_imgs_cache/Leonardo6_memecap/img_00001470.jpg,When you trying to convey that no phone will ever copy a gameboy,sarcastic-meme
dataset/_imgs_cache/Leonardo6_memecap/img_00001471.jpg,When your new texture pack is very realistic,sarcastic-meme
dataset/_imgs_cache/Leonardo6_memecap/img_00001472.jpg,The poster is saying that putting pineapple on pizza is worse than cutting it with scissors,sarcastic-meme
dataset/_imgs_cache/Leonardo6_memecap/img_00001473.jpg,When you trying to convey that Science is not always correct,sarcastic-meme
dataset/_imgs_cache/Leonardo6_memecap/img_00001474.jpg,When you confused to hear the secret,sarcastic-meme
dataset/_imgs_cache/Leonardo6_memecap/img_00001475.jpg,When you trying to convey that Mariah Carey is on the radio and Home Alone is on the...,sarcastic-meme
dataset/_imgs_cache/Leonardo6_memecap/img_00001476.jpg,The poster is conveying that the cat is actually a revolutionary,sarcastic-meme
dataset/_imgs_cache/Leonardo6_memecap/img_00001477.jpg,The poster is clueless why his spouse gets into a down bad mood very often,sarcastic-meme
dataset/_imgs_cache/Leonardo6_memecap/img_00001478.jpg,"When you trying to convey that they're tired of hearing ""All I Want for Christmas Is You"" in...",sarcastic-meme
dataset/_imgs_cache/Leonardo6_memecap/img_00001479.jpg,When you trying to convey that Actor in image always does horror movies where his character faces a...,sarcastic-meme
dataset/_imgs_cache/Leonardo6_memecap/img_00001480.jpg,The poster is talking about how their cat acts,sarcastic-meme
dataset/_imgs_cache/Leonardo6_memecap/img_00001481.jpg,When you trying to convey that they are addicted to their Nintendo,sarcastic-meme
dataset/_imgs_cache/Leonardo6_memecap/img_00001482.jpg,When you trying to convey that Three different video game characters have different goals for defeating their villain,sarcastic-meme
dataset/_imgs_cache/Leonardo6_memecap/img_00001483.jpg,When you trying to convey how electronics were made better back in 1990,sarcastic-meme
dataset/_imgs_cache/Leonardo6_memecap/img_00001484.jpg,When you thinks that the bird made of silverware is funny,sarcastic-meme
dataset/_imgs_cache/Leonardo6_memecap/img_00001485.jpg,When you trying to convey that his cat should eat whatever he wants to eat as he doesn't...,sarcastic-meme
dataset/_imgs_cache/Leonardo6_memecap/img_00001486.jpg,When you trying to convey that they prefer putting their phone in the pocket of their hoodie instead...,sarcastic-meme
dataset/_imgs_cache/Leonardo6_memecap/img_00001487.jpg,"When you thankful for their friends who include them in conversations, despite being quiet and reserved",sarcastic-meme
dataset/_imgs_cache/Leonardo6_memecap/img_00001488.jpg,When you trying to convey that bubble wrap that doesn't pop when squeezed is not nearly as appealing...,sarcastic-meme
dataset/_imgs_cache/Leonardo6_memecap/img_00001489.jpg,When you trying to convey that Philosophers will take a small inconvenience in life and always just explain...,sarcastic-meme
dataset/_imgs_cache/Leonardo6_memecap/img_00001490.jpg,"When you trying to convey that random questions like ""what is my blood type"" keep them up at...",sarcastic-meme
dataset/_imgs_cache/Leonardo6_memecap/img_00001491.jpg,When you trying to convey about racism,sarcastic-meme
dataset/_imgs_cache/Leonardo6_memecap/img_00001492.jpg,"The poster is laughing at the way people name their children, specially when they were born through a...",sarcastic-meme
dataset/_imgs_cache/Leonardo6_memecap/img_00001493.jpg,When you being smart and cultured unlike others,sarcastic-meme
dataset/_imgs_cache/Leonardo6_memecap/img_00001494.jpg,When you trying to convey how dramatic moms can be when buying Christmas presents from them,sarcastic-meme
dataset/_imgs_cache/Leonardo6_memecap/img_00001495.jpg,When you trying to convey that they don't have a good memory about going to scholastic book fairs...,sarcastic-meme
dataset/_imgs_cache/Leonardo6_memecap/img_00001496.jpg,When you trying to convey that Police officer is telling Andrew Tate he'll let him go for his...,sarcastic-meme
dataset/_imgs_cache/Leonardo6_memecap/img_00001497.jpg,The poster will win video games after they are banned in China,sarcastic-meme
dataset/_imgs_cache/Leonardo6_memecap/img_00001498.jpg,When you trying to convey that The meme user's inner peace and happiness is acquiring all the video...,sarcastic-meme
dataset/_imgs_cache/Leonardo6_memecap/img_00001499.jpg,When you trying to convey that Cultures are arguing about their weapons style while native americans weapons just...,sarcastic-meme
dataset/_imgs_cache/Leonardo6_memecap/img_00001500.jpg,When you trying to convey that Americans angrily say they are better than Europeans while Europe is at...,sarcastic-meme
dataset/_imgs_cache/Leonardo6_memecap/img_00001501.jpg,"When you trying to convey that They wanted to change the world but, in becoming wise, realized they...",sarcastic-meme
dataset/_imgs_cache/Leonardo6_memecap/img_00001502.jpg,When you doesn't believe the google maps,sarcastic-meme
dataset/_imgs_cache/Leonardo6_memecap/img_00001503.jpg,The poster feels that it is not a good idea to use a truck to heat up an...,sarcastic-meme
dataset/_imgs_cache/Leonardo6_memecap/img_00001504.jpg,When you sees a man being unreasonably happy everywhere they go,sarcastic-meme
dataset/_imgs_cache/Leonardo6_memecap/img_00001505.jpg,When you conveying that their mother is an unserious person for expecting things in return for her past...,sarcastic-meme
dataset/_imgs_cache/Leonardo6_memecap/img_00001506.jpg,When you trying to convey that Cheetah is considering killing the photographer after getting prompted to do it,sarcastic-meme
dataset/_imgs_cache/Leonardo6_memecap/img_00001507.jpg,When you talking about adding to France's electrical woes by removing critical infrastructure,sarcastic-meme
dataset/_imgs_cache/Leonardo6_memecap/img_00001508.jpg,When you trying to convey that Dog owner wants to give his dog a treat,sarcastic-meme
dataset/_imgs_cache/Leonardo6_memecap/img_00001509.jpg,When you trying to convey that They are appreciative of the extra hour of sleep they get during...,sarcastic-meme
dataset/_imgs_cache/Leonardo6_memecap/img_00001510.jpg,When you trying to convey that they don't want to get to know someone whose name they do...,sarcastic-meme
dataset/_imgs_cache/Leonardo6_memecap/img_00001511.jpg,When you trying to convey a story that starts normal and takes a weird unexpected twist,sarcastic-meme
dataset/_imgs_cache/Leonardo6_memecap/img_00001512.jpg,When you trying to convey that Rick Astley's music video taught users more about online security than all...,sarcastic-meme
dataset/_imgs_cache/Leonardo6_memecap/img_00001513.jpg,When you trying to convey that they're girlfriend assumed they called them a prostitute,sarcastic-meme
dataset/_imgs_cache/Leonardo6_memecap/img_00001514.jpg,When you trying to convey that Stork is taking a school kid bad to where they come from,sarcastic-meme
dataset/_imgs_cache/Leonardo6_memecap/img_00001515.jpg,When you trying to convey that what made him laugh so hard was the intelligent word play,sarcastic-meme
dataset/_imgs_cache/Leonardo6_memecap/img_00001516.jpg,When you trying to convey that men and women would have different priorities if a time machine were...,sarcastic-meme
