image_path,caption,style
dataset/_imgs_cache/Leonardo6_memecap/img_00004363.jpg,When you admires the barista who spit in their drink because they were being rude,sarcastic-meme
dataset/_imgs_cache/Leonardo6_memecap/img_00004364.jpg,When you creeped out by something their friend said about getting revenge on people at their school,sarcastic-meme
dataset/_imgs_cache/Leonardo6_memecap/img_00004365.jpg,When you trying to convey that the name Cricket in england is used for a sport,sarcastic-meme
dataset/_imgs_cache/Leonardo6_memecap/img_00004366.jpg,The meme is saying that professionals that actually get the job done as described are very rare in...,sarcastic-meme
dataset/_imgs_cache/Leonardo6_memecap/img_00004367.jpg,The meme poster mocks Argentina for loosing the match against Saudi Arabia in the FIFA 2023,sarcastic-meme
dataset/_imgs_cache/Leonardo6_memecap/img_00004368.jpg,"When you doesn't care that they've ruined their reputation, as it gives them more freedom",sarcastic-meme
dataset/_imgs_cache/Leonardo6_memecap/img_00004369.jpg,"When you tired of seeing sauce cat posts on reddit, but feels like other posters are milking the...",sarcastic-meme
dataset/_imgs_cache/Leonardo6_memecap/img_00004370.jpg,When you feeling bad about the match up and also not being bothered by the results,sarcastic-meme
dataset/_imgs_cache/Leonardo6_memecap/img_00004371.jpg,"When you trying to convey that reddit posters rarely if ever go outside, so this was posted as...",sarcastic-meme
dataset/_imgs_cache/Leonardo6_memecap/img_00004372.jpg,When you trying to convey that Saudi Arabia went after Messi in the soccer match when most of...,sarcastic-meme
dataset/_imgs_cache/Leonardo6_memecap/img_00004373.jpg,When you trying to convey that the install button on mobile ads is always a lot larger than...,sarcastic-meme
dataset/_imgs_cache/Leonardo6_memecap/img_00004374.jpg,When you trying to convey that dog and a man share a funny joke,sarcastic-meme
dataset/_imgs_cache/Leonardo6_memecap/img_00004375.jpg,When you trying to convey that not knowing what reddit means makes this person embarassed to admit,sarcastic-meme
dataset/_imgs_cache/Leonardo6_memecap/img_00004376.jpg,When you amazed after finding that Reddit has finally updated its video player,sarcastic-meme
dataset/_imgs_cache/Leonardo6_memecap/img_00004377.jpg,When you trying to convey that they over ate over the holidays,sarcastic-meme
dataset/_imgs_cache/Leonardo6_memecap/img_00004378.jpg,When you wants not to check the lock on the door multiple times but their ocd won't let...,sarcastic-meme
dataset/_imgs_cache/Leonardo6_memecap/img_00004379.jpg,This meme poster explains it as mocking the sea god,sarcastic-meme
dataset/_imgs_cache/Leonardo6_memecap/img_00004380.jpg,"The meme poster states that, its fair enough to accept the fact than fooling yourself",sarcastic-meme
dataset/_imgs_cache/Leonardo6_memecap/img_00004381.jpg,When you trying to convey that posting about the popular opinion of not watching FIFA gets people a...,sarcastic-meme
dataset/_imgs_cache/Leonardo6_memecap/img_00004382.jpg,When you saying that checking into airbnb is a hard process,sarcastic-meme
dataset/_imgs_cache/Leonardo6_memecap/img_00004383.jpg,When you trying to convey that how grandparents could act surprised at everything we used to do as...,sarcastic-meme
dataset/_imgs_cache/Leonardo6_memecap/img_00004384.jpg,"When you trying to convey that since people in the past died so early, the first people go...",sarcastic-meme
dataset/_imgs_cache/Leonardo6_memecap/img_00004385.jpg,When your wife can't sing and he wants to avoid it,sarcastic-meme
dataset/_imgs_cache/Leonardo6_memecap/img_00004386.jpg,When you wants to call out a reposter but knows people will think they are lying,sarcastic-meme
dataset/_imgs_cache/Leonardo6_memecap/img_00004387.jpg,The meme poster mocks the video game companies for their poor promotions,sarcastic-meme
dataset/_imgs_cache/Leonardo6_memecap/img_00004388.jpg,When you trying to convey that FIFA organization is corrupt and make deals all the time,sarcastic-meme
dataset/_imgs_cache/Leonardo6_memecap/img_00004389.jpg,When you feels different that before after their post was removed without explanation,sarcastic-meme
dataset/_imgs_cache/Leonardo6_memecap/img_00004390.jpg,When you trying to imply that eating is much more calm and fun activity than using the toilet...,sarcastic-meme
dataset/_imgs_cache/Leonardo6_memecap/img_00004391.jpg,When you trying to convey that how they doubt their success despite believing on achieving success,sarcastic-meme
dataset/_imgs_cache/Leonardo6_memecap/img_00004392.jpg,When you protecting their fast food bag from gravity on the ride home,sarcastic-meme
dataset/_imgs_cache/Leonardo6_memecap/img_00004393.jpg,When you tries to give advice but dies before it is given,sarcastic-meme
dataset/_imgs_cache/Leonardo6_memecap/img_00004394.jpg,When you trying to be in the background of a argument between their liberal and conservative family at...,sarcastic-meme
dataset/_imgs_cache/Leonardo6_memecap/img_00004395.jpg,When you trying to convey that the rap song on the bottom panel is more pleasant to the...,sarcastic-meme
dataset/_imgs_cache/Leonardo6_memecap/img_00004396.jpg,When you trying to convey that Piers Morgan can't go 10 seconds without interrupting people,sarcastic-meme
dataset/_imgs_cache/Leonardo6_memecap/img_00004397.jpg,When you trying to convey that casual phone users will no doubt waste their money on high duty...,sarcastic-meme
dataset/_imgs_cache/Leonardo6_memecap/img_00004398.jpg,When you trying to convey that Qatar residents do not like bright sun and rain,sarcastic-meme
dataset/_imgs_cache/Leonardo6_memecap/img_00004399.jpg,When you trying to convey that Mauritius has a flag with the pride colors that would be banned...,sarcastic-meme
dataset/_imgs_cache/Leonardo6_memecap/img_00004400.jpg,When you trying to convey that some random user advises the meme poster to take the COVID test...,sarcastic-meme
dataset/_imgs_cache/Leonardo6_memecap/img_00004401.jpg,The meme poster mocks the traffic rules and describing its expectations,sarcastic-meme
dataset/_imgs_cache/Leonardo6_memecap/img_00004402.jpg,When you trying to convey that Westerners don't understand when the rest of the world disagrees with them...,sarcastic-meme
dataset/_imgs_cache/Leonardo6_memecap/img_00004403.jpg,"When you feeling proud about his real character, which is not noticed by everyone",sarcastic-meme
dataset/_imgs_cache/Leonardo6_memecap/img_00004404.jpg,When you conveying boredom while waiting on someone to come back,sarcastic-meme
dataset/_imgs_cache/Leonardo6_memecap/img_00004405.jpg,When you tries to spin different ways to think about getting bit by their kid,sarcastic-meme
dataset/_imgs_cache/Leonardo6_memecap/img_00004406.jpg,When you gets mad when they see YouTube ads for terrible looking fake games,sarcastic-meme
dataset/_imgs_cache/Leonardo6_memecap/img_00004407.jpg,When you trying to convey that they have a lot of unfunny memes saved in their phone,sarcastic-meme
dataset/_imgs_cache/Leonardo6_memecap/img_00004408.jpg,When you trying to convey that sometimes relaxing can go to far,sarcastic-meme
dataset/_imgs_cache/Leonardo6_memecap/img_00004409.jpg,When you trying to convey that the the hundreds of anime in the list are mad for ignoring...,sarcastic-meme
dataset/_imgs_cache/Leonardo6_memecap/img_00004410.jpg,When you trying to convey that Reddit when England and the US play each other in the World...,sarcastic-meme
dataset/_imgs_cache/Leonardo6_memecap/img_00004411.jpg,The meme poster wants to express how he feels when his friends let him down on special occasions,sarcastic-meme
dataset/_imgs_cache/Leonardo6_memecap/img_00004412.jpg,When you tryin to convey that you should always ask something for your birthday,sarcastic-meme
dataset/_imgs_cache/Leonardo6_memecap/img_00004413.jpg,When you making fun of Jeep owners who drive like maniacs in the snow,sarcastic-meme
dataset/_imgs_cache/Leonardo6_memecap/img_00004414.jpg,When you doesn't like the format anymore so they make a random object,sarcastic-meme
dataset/_imgs_cache/Leonardo6_memecap/img_00004415.jpg,When you cuts the tops off their gloves to show off their toys,sarcastic-meme
dataset/_imgs_cache/Leonardo6_memecap/img_00004416.jpg,"When you trying to convey that he is disgusted with people that actually pee in the pool, he...",sarcastic-meme
dataset/_imgs_cache/Leonardo6_memecap/img_00004417.jpg,When you trying to convey that Spiderman smiles when his grandma asks him about his sexual prowess,sarcastic-meme
dataset/_imgs_cache/Leonardo6_memecap/img_00004418.jpg,The poster is trying to express how he feels when he is all out to attack someone with...,sarcastic-meme
dataset/_imgs_cache/Leonardo6_memecap/img_00004419.jpg,When you wakes up to early to get the testosterones relief,sarcastic-meme
dataset/_imgs_cache/Leonardo6_memecap/img_00004420.jpg,When you mad because their mother bought a counterfeit version of Uno,sarcastic-meme
dataset/_imgs_cache/Leonardo6_memecap/img_00004421.jpg,When you trying to convey that not every girl knows what a man is listening to and that...,sarcastic-meme
dataset/_imgs_cache/Leonardo6_memecap/img_00004422.jpg,When you wants to thank their inspiration and is clear who their mentor was and who it wasn't,sarcastic-meme
dataset/_imgs_cache/Leonardo6_memecap/img_00004423.jpg,When you knows how they will terrorize the neighbors after the power goes out,sarcastic-meme
dataset/_imgs_cache/Leonardo6_memecap/img_00004424.jpg,When you trying to convey that there the only person that is born cool not anyone else,sarcastic-meme
dataset/_imgs_cache/Leonardo6_memecap/img_00004425.jpg,When you trying to convey that Mom's cell phone brightness are always way brighter than everything around them,sarcastic-meme
dataset/_imgs_cache/Leonardo6_memecap/img_00004426.jpg,When you tired of football vs soccer arguments when they are both correct,sarcastic-meme
dataset/_imgs_cache/Leonardo6_memecap/img_00004427.jpg,When your younger cousin will yell in the meme poster's ear giving them tinnitius,sarcastic-meme
dataset/_imgs_cache/Leonardo6_memecap/img_00004428.jpg,When you trying to convey that the elites are hoarding all the wealth,sarcastic-meme
dataset/_imgs_cache/Leonardo6_memecap/img_00004429.jpg,When you trying to convey that the Argentina soccer team tried to act all tough in the world...,sarcastic-meme
dataset/_imgs_cache/Leonardo6_memecap/img_00004430.jpg,When you trying to convey that the normal people in Hiroshima were unreasonably happy at the morning and...,sarcastic-meme
dataset/_imgs_cache/Leonardo6_memecap/img_00004431.jpg,When you surprised to learn from others it's their cake day today,sarcastic-meme
dataset/_imgs_cache/Leonardo6_memecap/img_00004432.jpg,This meme poster illustrates the importance of being careful when playing video games,sarcastic-meme
dataset/_imgs_cache/Leonardo6_memecap/img_00004433.jpg,"When you mocking Elon Musk that, Elon will easily rely on his supporters",sarcastic-meme
dataset/_imgs_cache/Leonardo6_memecap/img_00004434.jpg,When you trying to convey that Reddit will fight when the US plays England in the World Cup,sarcastic-meme
dataset/_imgs_cache/Leonardo6_memecap/img_00004435.jpg,When you wants creators to know that smartphone designs will never change so their shows won't age but...,sarcastic-meme
dataset/_imgs_cache/Leonardo6_memecap/img_00004436.jpg,When you trying to convey that Cookie monster is concerned at how old Ernie's girlfriend is,sarcastic-meme
dataset/_imgs_cache/Leonardo6_memecap/img_00004437.jpg,When you trying to convey that they ignore posts that are too long,sarcastic-meme
dataset/_imgs_cache/Leonardo6_memecap/img_00004438.jpg,When you trying to convey that road they are on is not easy to navigate,sarcastic-meme
dataset/_imgs_cache/Leonardo6_memecap/img_00004439.jpg,When you wants thanksgiving visitors to be there for two hours or less,sarcastic-meme
dataset/_imgs_cache/Leonardo6_memecap/img_00004440.jpg,When you trying to convey that the Hitler version refuses to bring back the Jews that died from...,sarcastic-meme
dataset/_imgs_cache/Leonardo6_memecap/img_00004441.jpg,The meme poster mocks the students of Ph,sarcastic-meme
dataset/_imgs_cache/Leonardo6_memecap/img_00004442.jpg,When you trying to convey that people with eating disorders have a tough time trying to survive holiday...,sarcastic-meme
dataset/_imgs_cache/Leonardo6_memecap/img_00004443.jpg,"When you trying to convey that even though they would book an appointment for a light trim, they...",sarcastic-meme
dataset/_imgs_cache/Leonardo6_memecap/img_00004444.jpg,When you trying to convey that the missing piece in everyones life is a billion dollars,sarcastic-meme
dataset/_imgs_cache/Leonardo6_memecap/img_00004445.jpg,The meme poster feels disgusted by seeing the couple's kiss while he has his fruit salad,sarcastic-meme
dataset/_imgs_cache/Leonardo6_memecap/img_00004446.jpg,The meme poster mocks Saudi Arabia for announcing a holiday to celebrate its victory over Argentina,sarcastic-meme
dataset/_imgs_cache/Leonardo6_memecap/img_00004447.jpg,When you trying to convey that Elon Musk is being closed watch by his haters,sarcastic-meme
dataset/_imgs_cache/Leonardo6_memecap/img_00004448.jpg,When you trying to convey they say some nasty things while playing video games and not assume they...,sarcastic-meme
dataset/_imgs_cache/Leonardo6_memecap/img_00004449.jpg,"When you trying to convey that Of all the illness that cause you head pain, boy is the...",sarcastic-meme
dataset/_imgs_cache/Leonardo6_memecap/img_00004450.jpg,When you trying to convey that this is how a person looks that hates Qatar,sarcastic-meme
dataset/_imgs_cache/Leonardo6_memecap/img_00004451.jpg,When you makes fun of person for working late when they do it themselves,sarcastic-meme
dataset/_imgs_cache/Leonardo6_memecap/img_00004452.jpg,When you trying to convey that a feeling of surprise for an unexpected outcome,sarcastic-meme
dataset/_imgs_cache/Leonardo6_memecap/img_00004453.jpg,The meme poster thinks nothing else gives the more emotional boost of being powerful when sitting on the...,sarcastic-meme
dataset/_imgs_cache/Leonardo6_memecap/img_00004454.jpg,When you trying to convey that having a character named bra is just asking for people to make...,sarcastic-meme
dataset/_imgs_cache/Leonardo6_memecap/img_00004455.jpg,When you trying to convey that James Cameron dreams of being Navi creating the new avatar movie,sarcastic-meme
dataset/_imgs_cache/Leonardo6_memecap/img_00004456.jpg,"The meme poster conveys that, the first song on Nickelbaks' new album is aggressive, and the rest of...",sarcastic-meme
dataset/_imgs_cache/Leonardo6_memecap/img_00004457.jpg,When you trying to convey that a dog playing with squeaky toy annoys them,sarcastic-meme
dataset/_imgs_cache/Leonardo6_memecap/img_00004458.jpg,When you believes that many of the comments posted on YouTube under videos for down bad songs are...,sarcastic-meme
dataset/_imgs_cache/Leonardo6_memecap/img_00004459.jpg,When you shocked to learn of the direction of his favorite show then comes to peace with it,sarcastic-meme
dataset/_imgs_cache/Leonardo6_memecap/img_00004460.jpg,The meme poster feels homeless people exaggerate their plight,sarcastic-meme
dataset/_imgs_cache/Leonardo6_memecap/img_00004461.jpg,When you way more excited to set their tv to a loud volume than a normal setting,sarcastic-meme
dataset/_imgs_cache/Leonardo6_memecap/img_00004462.jpg,"When you trying to convey that they are classier and more cultured than those who litter trash, as...",sarcastic-meme
dataset/_imgs_cache/Leonardo6_memecap/img_00004463.jpg,When you mocks our former president by comparing his name with steak,sarcastic-meme
dataset/_imgs_cache/Leonardo6_memecap/img_00004464.jpg,When you trying to convey that they love pizza and their stomach won't get pissed after eating it,sarcastic-meme
dataset/_imgs_cache/Leonardo6_memecap/img_00004465.jpg,When you trying to convey that writing the SATs gets your email put on a list of universities...,sarcastic-meme
dataset/_imgs_cache/Leonardo6_memecap/img_00004466.jpg,When you trying to convey that fifa has human rights violations of their own so they support Qatar's,sarcastic-meme
dataset/_imgs_cache/Leonardo6_memecap/img_00004467.jpg,"The meme poster promotes Snickers that, it could satisfy our hunger and get rid of being anger by...",sarcastic-meme
dataset/_imgs_cache/Leonardo6_memecap/img_00004468.jpg,The meme poster mocks the RedBul19 at 2023 F1,sarcastic-meme
dataset/_imgs_cache/Leonardo6_memecap/img_00004469.jpg,When you trying to convey that artists draw anime girls to have translucent clothes after the rain,sarcastic-meme
dataset/_imgs_cache/Leonardo6_memecap/img_00004470.jpg,The meme poster realizes that the boy she is lowkey into is the meme poster himself,sarcastic-meme
dataset/_imgs_cache/Leonardo6_memecap/img_00004471.jpg,When you trying to convey that Elon and Trump realize their parents made their money similarly and become...,sarcastic-meme
dataset/_imgs_cache/Leonardo6_memecap/img_00004472.jpg,When you has accepted no one will hit on him at a Starbucks and will just enjoy their...,sarcastic-meme
dataset/_imgs_cache/Leonardo6_memecap/img_00004473.jpg,When you when they click on a video they watched already because the creator changed the title,sarcastic-meme
dataset/_imgs_cache/Leonardo6_memecap/img_00004474.jpg,When you trying to convey about working extra hard at retail during the christmas holidays,sarcastic-meme
dataset/_imgs_cache/Leonardo6_memecap/img_00004475.jpg,When you trying to convey that time in animation is way different in real life,sarcastic-meme
dataset/_imgs_cache/Leonardo6_memecap/img_00004476.jpg,The poster wants to express his experience when he gets to know a girl which excites him initially...,sarcastic-meme
dataset/_imgs_cache/Leonardo6_memecap/img_00004477.jpg,When you saying the the Qatar government hates when the rainbows form after the rain and would rather...,sarcastic-meme
dataset/_imgs_cache/Leonardo6_memecap/img_00004478.jpg,When you trying to convey that each video game cover is color coordinated with the pictures on the...,sarcastic-meme
dataset/_imgs_cache/Leonardo6_memecap/img_00004479.jpg,When you trying to play out to be what is not expected of him by doing crazy things,sarcastic-meme
dataset/_imgs_cache/Leonardo6_memecap/img_00004480.jpg,When you trying to convey that no one really cares about Jack White leaving Twitter,sarcastic-meme
dataset/_imgs_cache/Leonardo6_memecap/img_00004481.jpg,When you interested in the idea of developing the Star Wars theme in software,sarcastic-meme
dataset/_imgs_cache/Leonardo6_memecap/img_00004482.jpg,The meme poster wants to slam Joshua Weissman to the ground because he does not agree with the...,sarcastic-meme
dataset/_imgs_cache/Leonardo6_memecap/img_00004483.jpg,When you trying to convey that the corrupt FIFA executives are down bad they are being accused of...,sarcastic-meme
dataset/_imgs_cache/Leonardo6_memecap/img_00004484.jpg,When you trying to convey that not everything you see is true by questioning the image's authenticity,sarcastic-meme
dataset/_imgs_cache/Leonardo6_memecap/img_00004485.jpg,When you feels like they are hanging on to dear life,sarcastic-meme
dataset/_imgs_cache/Leonardo6_memecap/img_00004486.jpg,When you trying to convey that Strength and Resistance training in the gym are two similar sets of...,sarcastic-meme
dataset/_imgs_cache/Leonardo6_memecap/img_00004487.jpg,The meme poster does not like people who defend justice to use the name of Will smith wife...,sarcastic-meme
dataset/_imgs_cache/Leonardo6_memecap/img_00004488.jpg,When you trying to figure out when bread becomes toast in a toaster,sarcastic-meme
dataset/_imgs_cache/Leonardo6_memecap/img_00004489.jpg,When you trying to convey that Texas can't take the cold while Canadians and Greenlanders are well adapted...,sarcastic-meme
dataset/_imgs_cache/Leonardo6_memecap/img_00004490.jpg,When you trying to convey that they are trying to convey they are the only person that don't...,sarcastic-meme
dataset/_imgs_cache/Leonardo6_memecap/img_00004491.jpg,When you trying to convey that Fox News is just coverage of Hunter Biden scandals right now,sarcastic-meme
dataset/_imgs_cache/Leonardo6_memecap/img_00004492.jpg,When you trying to convey that they have a short temper,sarcastic-meme
dataset/_imgs_cache/Leonardo6_memecap/img_00004493.jpg,Poster thinks restaurant portions have gotten very small,sarcastic-meme
dataset/_imgs_cache/Leonardo6_memecap/img_00004494.jpg,When you trying to convey that man with shaving cream in his hand is waiting for him mom...,sarcastic-meme
dataset/_imgs_cache/Leonardo6_memecap/img_00004495.jpg,When you less enthusiastic about Christmas than his neighbors,sarcastic-meme
dataset/_imgs_cache/Leonardo6_memecap/img_00004496.jpg,When you does not like it when someone surprises them by touching their neck with cold hands,sarcastic-meme
dataset/_imgs_cache/Leonardo6_memecap/img_00004497.jpg,The meme poster mocks Qatar for its issue with beer and alcohol,sarcastic-meme
dataset/_imgs_cache/Leonardo6_memecap/img_00004498.jpg,When you makes a pun about Hanson's name,sarcastic-meme
dataset/_imgs_cache/Leonardo6_memecap/img_00004499.jpg,"When you loves themselves, so they don't care when people insult them",sarcastic-meme
dataset/_imgs_cache/Leonardo6_memecap/img_00004500.jpg,"As the meme poster is British, he doesn't like calling football soccer",sarcastic-meme
dataset/_imgs_cache/Leonardo6_memecap/img_00004501.jpg,When you trying to convey that Twitter is challenging YouTube because YouTube is stealing Twitter's best ideas,sarcastic-meme
dataset/_imgs_cache/Leonardo6_memecap/img_00004502.jpg,When you willing to fame cake day drama than being a respectable human being,sarcastic-meme
dataset/_imgs_cache/Leonardo6_memecap/img_00004503.jpg,"The meme poster conform that, after the takeover of Twitter, the person is destroying his reputation among the...",sarcastic-meme
dataset/_imgs_cache/Leonardo6_memecap/img_00004504.jpg,When you trying to convey that people are unreasonably happy the antacids they took may prevent stomach burn,sarcastic-meme
dataset/_imgs_cache/Leonardo6_memecap/img_00004505.jpg,When you trying to convey that the average metal fan is big mad in a way the average...,sarcastic-meme
dataset/_imgs_cache/Leonardo6_memecap/img_00004506.jpg,When you trying to convey that the us did socialism right all along despite what socialists think,sarcastic-meme
dataset/_imgs_cache/Leonardo6_memecap/img_00004507.jpg,"When you trying to convey that there are better things in life than smoking meth, and that's eating...",sarcastic-meme
dataset/_imgs_cache/Leonardo6_memecap/img_00004508.jpg,When you trying to convey that doctors are always late to your appointments and refuse to apologize while...,sarcastic-meme
dataset/_imgs_cache/Leonardo6_memecap/img_00004509.jpg,When you tries to convince others to not visit or watch the World Cup in Qatar,sarcastic-meme
dataset/_imgs_cache/Leonardo6_memecap/img_00004510.jpg,When you trying to convey that the French goalkeeper is a lot better than the Australian one,sarcastic-meme
dataset/_imgs_cache/Leonardo6_memecap/img_00004511.jpg,"Despite the fact that Qatar banned liquor, the meme poster is anointing that it will supply all its...",sarcastic-meme
dataset/_imgs_cache/Leonardo6_memecap/img_00004512.jpg,When you trying to convey that the media is falsely portraying Mexico as a superior country to Poland,sarcastic-meme
dataset/_imgs_cache/Leonardo6_memecap/img_00004513.jpg,Poster finds his twentieth essay less iintimidating than his first,sarcastic-meme
dataset/_imgs_cache/Leonardo6_memecap/img_00004514.jpg,When you trying to convey that they fell down a rabbit looking up model paintings knowing that the...,sarcastic-meme
dataset/_imgs_cache/Leonardo6_memecap/img_00004515.jpg,When you trying to convey that the character is amazed by the mail from an anonymous person,sarcastic-meme
dataset/_imgs_cache/Leonardo6_memecap/img_00004516.jpg,"While the meme poster doesn't know anything about the World Cup, he will fake having opinions to talk...",sarcastic-meme
dataset/_imgs_cache/Leonardo6_memecap/img_00004517.jpg,When you seeking the right reason to be unreasonably happy in college,sarcastic-meme
dataset/_imgs_cache/Leonardo6_memecap/img_00004518.jpg,When you describes that being a good person and being a good looking person isn't same,sarcastic-meme
dataset/_imgs_cache/Leonardo6_memecap/img_00004519.jpg,When you looks upon a meme they made by accident,sarcastic-meme
dataset/_imgs_cache/Leonardo6_memecap/img_00004520.jpg,When you trying to convey that Anime would be better if it had American cartoon villains like syndrome,sarcastic-meme
dataset/_imgs_cache/Leonardo6_memecap/img_00004521.jpg,When you trying to convey that it's always uncomfortable when a hard crunch happens when you are eating...,sarcastic-meme
dataset/_imgs_cache/Leonardo6_memecap/img_00004522.jpg,When you trying to convey that Filipinos love Mariah Carey's Christmas songs,sarcastic-meme
dataset/_imgs_cache/Leonardo6_memecap/img_00004523.jpg,When you in pain from sitting in their gaming chair,sarcastic-meme
dataset/_imgs_cache/Leonardo6_memecap/img_00004524.jpg,"When you compares telling neurotypical people they are autistic, who freak out and don't believe them, to other...",sarcastic-meme
dataset/_imgs_cache/Leonardo6_memecap/img_00004525.jpg,When you trying to convey that Apple has a meeting where the right answer is to install Windows...,sarcastic-meme
dataset/_imgs_cache/Leonardo6_memecap/img_00004526.jpg,When you believes the subreddit dragonsfuckingcars can damage you,sarcastic-meme
dataset/_imgs_cache/Leonardo6_memecap/img_00004527.jpg,When you trying to convey that Twitter users keep laughing at Elon memes despite them being all the...,sarcastic-meme
